### ISSUE TITLE
Syslog events ingesting issue

### ISSUE THREAD

**Issue by j0serca** [wazuh/wazuh#14443]
|Wazuh version|Component|Install type|Install method|Platform|
|---|---|---|---|---|
| v4.3.5 | syslog/remoted | Manager| Packages/Sources | CentOS |

## Description
Hi team,
When enabling the `<remote>` module to ingest syslog data from a network device, wazuh is not registering that data and thus, alerts do not get generated.

I've verified with a `tcpdump` that the events are getting to the manager (there's no Firewall in between) through port 514 udp, but after enabling `logall_json` option, they are not being registered on the `archives.json` file.

I've verified that both the device and manager IPs are correct, that there is no other `syslog` service that might be capturing those events instead of Wazuh and that there are no errors related to `syslog` or `remoted` on the `ossec.log` file.

## Findings

This is the `tcpdump` where you can see 3 (of many) of the events that I need:
```
root@:/var/ossec/logs/archives# tcpdump -i eth0 host <IP> and port 514 and udp -AA

tcpdump: verbose output suppressed, use -v or -vv for full protocol decode

listening on eth0, link-type EN10MB (Ethernet), capture size 262144 bytes

18:48:08.969964 IP .14879 > .syslog: SYSLOG user.notice, length: 1096

..:......f8...E..d$...@..8....

...:....P}K<13>date=2022-07-27 time=18:46:39 devname="FGT" devid="FG100FTK19016521" eventtime=1658958399655232621 tz="-0300" logid="0000000020" type="traffic" subtype="forward" level="notice" vd="root" srcip= srcname="SUPSEG-023" srcport=62074 srcintf="lan" srcintfrole="lan" dstip= dstport=443 dstintf="wan1" dstintfrole="wan" srcuuid="1ae9e734-ea4b-51e9-6d00-fb9c61f0590e" dstuuid="1ae9e734-ea4b-51e9-6d00-fb9c61f0590e" srccountry="Reserved" dstcountry="Argentina" sessionid=49504773 proto=6 action="accept" policyid=2 policytype="policy" poluuid="f2ee8924-0993-51eb-c82d-a39e2373df37" policyname="Salida a internet Oficina" service="HTTPS" trandisp="snat" transip= transport=62074 appid=42533 app="Google.Services" appcat="General.Interest" apprisk="elevated" applist="Filtrado B..sico" duration=3348 sentbyte=44870 rcvdbyte=55013 sentpkt=558 rcvdpkt=655 vwlid=0 sentdelta=1637 rcvddelta=2014 osname="Windows" srcswversion="10" unauthuser="fm70805" unauthusersource="kerberos" mastersrcmac="" srcmac="" srcserver=0

18:48:09.009843 IP .14879 > .syslog: SYSLOG user.notice, length: 783

..:......f8...E..+$...@..p....

...:.......<13>date=2022-07-27 time=18:46:39 devname="FGT" devid="FG100FTK19016521" eventtime=1658958399694912341 tz="-0300" logid="0000000013" type="traffic" subtype="forward" level="notice" vd="root" srcip= srcport=51386 srcintf="ToAzure" srcintfrole="undefined" dstip= dstport=10050 dstintf="Enlace" dstintfrole="wan" srcuuid="1ae9e734-ea4b-51e9-6d00-fb9c61f0590e" dstuuid="1ae9e734-ea4b-51e9-6d00-fb9c61f0590e" srccountry="Reserved" dstcountry="Reserved" sessionid=49573377 proto=6 action="close" policyid=21 policytype="policy" poluuid="7ec16d5c-5509-51eb-8983-d25d2e1f5603" policyname="NAT" service="tcp/10050" trandisp="noop" duration=2 sentbyte=360 rcvdbyte=230 sentpkt=6 rcvdpkt=4 vpn="ToAzure" vpntype="ipsec-static" appcat="unscanned"

18:48:09.121094 IP .4507 > .syslog: SYSLOG user.notice, length: 1076

..:......f8...E..P$...@..J....

........<.7<13>date=2022-07-27 time=18:46:39 devname="FGT" devid="FG100FTK19016521" eventtime=1658958399804912141 tz="-0300" logid="0000000013" type="traffic" subtype="forward" level="notice" vd="root" srcip= srcname="DD-8DWMD42..AD" identifier=1 srcintf="lan" srcintfrole="lan" dstip= dstintf="ToAzure" dstintfrole="undefined" srcuuid="1ae9e734-ea4b-51e9-6d00-fb9c61f0590e" dstuuid="1ae9e734-ea4b-51e9-6d00-fb9c61f0590e" srccountry="Reserved" dstcountry="Reserved" sessionid=49572176 proto=1 action="accept" policyid=4 policytype="policy" poluuid="9ebdc8c0-17a7-51eb-b30a-0425a930bd48" policyname="toazure" service="PING" trandisp="noop" appid=24466 app="Ping" appcat="Network.Service" apprisk="elevated" applist="Filtrado B..sico" duration=67 sentbyte=240 rcvdbyte=240 sentpkt=4 rcvdpkt=4 vpn="ToAzure" vpntype="ipsec-static" utmaction="allow" countapp=1 srchwvendor="Dell" osname="Windows" srcswversion="7" unauthuser="GS60583" unauthusersource="kerberos" mastersrcmac="" srcmac="" srcserver=0
```

This is part of my `ossec.conf` file:
```
<ossec_config>

<global>

<jsonout_output>yes</jsonout_output>

<alerts_log>yes</alerts_log>

<logall>no</logall>

<logall_json>yes</logall_json>

<email_notification>no</email_notification>

<smtp_server>localhost</smtp_server>

<email_maxperhour>12</email_maxperhour>

<email_log_source>alerts.log</email_log_source>

<agents_disconnection_time>10m</agents_disconnection_time>

<agents_disconnection_alert_time>0</agents_disconnection_alert_time>

</global>

 

<alerts>

<log_alert_level>3</log_alert_level>

<email_alert_level>12</email_alert_level>

</alerts>


<remote>

<connection>secure</connection>

<port>1514</port>

<protocol>tcp</protocol>

<queue_size>131072</queue_size>

</remote>


<remote>

<connection>syslog</connection>

<port>514</port>

<protocol>udp</protocol>

<allowed-ips>x.x.x.x</allowed-ips>

<local_ip>x.x.x.x</local_ip>

</remote>

...
</ossec_config>
```

But when I try to search for these logs in the `archives.json` file, I get no results:

![No_Logs_Archives-json2](https://user-images.githubusercontent.com/93411185/181389851-b4a3255a-c52c-415c-bd86-c42c0246c7d9.png)

Can you please help me with this?

Thank you!

**Comment by jotacarma90** [comment]
## Issue update
Hello team!
I have been testing this issue, and I have not been able to reproduce the problem.
Details of my environment and tests:

- Manager configuration:
```xml
<remote>
  <conexión>syslog</conexión>
  <puerto>514</puerto>
  <protocolo>udp</protocolo>
  <p>Permitidos-ips>10.0.2.15</p> <p>Permitidos-ips>
  <local_ip>172.16.1.71</local_ip>
</remote>
```
- I have configured rsyslog in the style of this blogpost, to send logs via syslog to the manager. I can see the corresponding alerts in the alerts.log:
```
** Alert 1660811382.144104: - syslog,access_control,authentication_failed,pci_dss_10.2.4,pci_dss_10.2.5,gpg13_7.8,gdpr_IV_35.7.d,gdpr_IV_32.2,hipaa_164.312.b,nist_800_53_AU.14, nist_800_53_AC.7,tsc_CC6.1,tsc_CC6.8,tsc_CC7.2,tsc_CC7.3,
2022 Aug 18 08:29:42 (centos8qactl2) any->/var/log/messages
Regla: 2501 (nivel 5) -> 'syslog: Fallo de autenticación de usuario.'
Aug 18 08:29:41 centos8qactl2 my_program "app": "core", "message": "Login failed: 'admin' (Remote IP: '127.0.0.1', X-Forwarded-For: '')", "level":2, "time": "2015-06-09T08:16:29+00:00","@source": "ownCloud"}
```
- And the corresponding log in the archives.json:

```
{"timestamp":"2022-08-18T08:29:42.532+0000","rule":{"level":5,"description":"syslog: Fallo de autenticación de usuario", "id": "2501", "firedtimes":1, "mail":false, "groups":["syslog", "access_control", "authentication_failed"], "pci_dss":["10. 2.4","10.2.5"],"gpg13":["7.8"],"gdpr":["IV_35.7.d","IV_32.2"],"hipaa":["164.312.b"],"nist_800_53":["AU.14 ", "AC.7 "],"tsc":["CC6.1","CC6.8","CC7.2","CC7.3"]},"agent":{"id":"001","name":"centos8qactl2","ip":"10.0.2.15"},"manager":{"name":"centos8qactl"},"id":"1660811382. 144104", "full_log": "Aug 18 08:29:41 centos8qactl2 my_program \"app\":\"core\",\"message\":\"Login failed: 'admin' (Remote IP: '127. 0.0. 1', X-Forwarded-For: '')\",\"level\":2,\"time\":\"2015-06-09T08:16:29+00:00\",\"@source\":\"ownCloud\"}","predecoder": {"timestamp":"Aug 18 08:29:41","hostname":"centos8qactl2"},"decoder":{},"location":"/var/log/messages"}
```

I can't find a way to reproduce the mentioned problem, all the flow seems to be correct.

**Comment by j0serca** [comment]
Hi team,
Thank you for all your help, we can confirm that this is working after your intervention.
Cheers!

**Comment by jyqueri** [comment]
Hi!
I have the same problem, I see it in the tcpdump but I don't store it.
What steps did you take to later receive it?

**Comment by jyqueri** [comment]
> Hi team, Thank you for all your help, we can confirm that this is working after your intervention. Cheers!

Hi!
I have the same problem, I see it in the tcpdump but I don't store it.
What steps did you take to later receive it?

**Comment by dmoroney** [comment]
Having the same problem. Manager isn't ingesting the Agent forwarded syslog messages from the Endpoint.

All Ubuntu 22.04-LTS firewalls are off

All IP's are in the same /24 CIDR
```
E.E.E.E - Endpoint is a syslog sender that can't host an Agent
A.A.A.A - Agent + rsyslog
M.M.M.M - Manager
```
Using the Manager settings
```
/var/ossec/etc/ossec.conf:
  <ossec_config>
    <remote>
      <connection>syslog</connection>
      <port>514</port>
      <protocol>udp</protocol>
      <allowed-ips>M.M.M.0/24</allowed-ips>
      <local_ip>M.M.M.M</local_ip>
    </remote>
  </ossec_config>

/etc/filebeat/filebeat.yml:
  filebeat.modules:
    - module: wazuh
      alerts:
        enabled: true
      archives:
        enabled: true

# systemctl restart filebeat wazuh-manager 
```
Send syslog message(s) from E.E.E.E directly to M.M.M.M
Go to Wazuh Manager->Discover...........nothing

Using the Agent settings
```
/etc/rsyslog.conf:
  module(load="imudp")
  input(type="imudp" port="514")

  #
  # Forward syslog messages from remote systems
  #
  if ($fromhost-ip == "E.E.E.E") then {
    *.* action(type="omfwd" target="M.M.M.M" port="514")
  }

/var/ossec/etc/ossec.conf:
  <ossec_config>
    <localfile>
      <log_format>syslog</log_format>
      <location>/var/log/syslog</location>
    </localfile>
  </ossec_config>

# systemctl restart rsyslog wazuh-agent
# grep "/var/log/syslog" /var/ossec/logs/ossec.log
YYYY/mm/dd hh:mm:ss wazuh-logcollector: INFO: (1950): Analyzing file: '/var/log/syslog'.
```
Send syslog message(s) from E.E.E.E to A.A.A,A. Expect forwarding to M.M.M.M
A.A.A.A:/var/log/syslog has the messages sent from E.E.E.E
Go to Wazuh Manager->Discover...........nothing
