### ISSUE TITLE
TCP Syslog remote is not processing all the messages

### ISSUE THREAD

**Issue by fhielpos** [wazuh/wazuh#12389]
|Wazuh version|Component|Install type|Install method|Platform|
|---|---|---|---|---|
| 4.2.5 | wazuh-remoted | Manager | Packages/Sources | Centos 7 |

Hello team,

We have discovered that the `syslog` remote over TCP does not process all the messages, not triggering any alerts or sending the events into `archives` either.

## Analysis

**Wazuh Manager:** `192.168.1.222`
**Syslog client:** `192.168.1.101`

**Manager configuration:**

```xml
  <remote>
    <connection>syslog</connection>
    <port>514</port>
    <protocol>tcp</protocol>
    <local_ip>192.168.1.222</local_ip>
    <allowed-ips>192.168.1.101</allowed-ips>
  </remote>
```

**Syslog client configuration (rsyslog):**

```
*.* action(type="omfwd"
	target="192.168.1.222"
	port="514" protocol="tcp"
	queue.type="LinkedList"
	queue.filename="wazuh_syslog"
	queue.saveOnShutdown="on"
	action.resumeRetryCount="-1")
```

**Ensure that remoted is listening and with an established connection:**

```
ss -tnap | grep -E "State|514" -w
State      Recv-Q Send-Q Local Address:Port               Peer Address:Port
LISTEN     0      128    192.168.1.222:514                      *:*                   users:(("wazuh-remoted",pid=8334,fd=4),("wazuh-remoted",pid=7724,fd=4))
ESTAB      0      0      192.168.1.222:514                192.168.1.101:33584               users:(("wazuh-remoted",pid=8334,fd=6))
```

**Ensure that we are receiving messages with `tcpdump`:**

```
tcpdump -i any port 514 -A
tcpdump: verbose output suppressed, use -v or -vv for full protocol decode
listening on any, link-type LINUX_SLL (Linux cooked), capture size 262144 bytes
18:02:19.327483 IP 192.168.1.101.33600 > wazuh-manager.shell: Flags [P.], seq 114509791:114509864, ack 1604809177, win 502, options [nop,nop,TS val 1477285093 ecr 256329654], length 73
E..}ZX@.@.[....e.....@....G._.q............
X....GG.<13>Feb 21 18:02:19 syslog-client root: Test number: 1 test message and sleep
................
18:02:19.329520 IP wazuh-manager.shell > 192.168.1.101.33600: Flags [.], ack 73, win 255, options [nop,nop,TS val 256348227 ecr 1477285093], length 0
E..4..@.@..........e...@_.q...H(...........
.G.CX...................
18:02:24.338428 IP 192.168.1.101.33600 > wazuh-manager.shell: Flags [P.], seq 73:146, ack 1, win 502, options [nop,nop,TS val 1477290105 ecr 256348227], length 73
E..}ZY@.@.[....e.....@....H(_.q.....5H.....
X..y.G.C<13>Feb 21 18:02:24 syslog-client root: Test number: 2 test message and sleep
................
18:02:24.339364 IP wazuh-manager.shell > 192.168.1.101.33600: Flags [.], ack 146, win 255, options [nop,nop,TS val 256353237 ecr 1477290105], length 0
E..4..@.@..........e...@_.q...Hq...........
.G..X..y................
18:02:29.355136 IP 192.168.1.101.33600 > wazuh-manager.shell: Flags [P.], seq 146:219, ack 1, win 502, options [nop,nop,TS val 1477295121 ecr 256353237], length 73
E..}ZZ@.@.[....e.....@....Hq_.q............
X....G..<13>Feb 21 18:02:29 syslog-client root: Test number: 3 test message and sleep
................
18:02:29.357750 IP wazuh-manager.shell > 192.168.1.101.33600: Flags [.], ack 219, win 255, options [nop,nop,TS val 256358254 ecr 1477295121], length 0
E..4..@.@..........e...@_.q...H............
.G.nX...................
18:02:34.386329 IP 192.168.1.101.33600 > wazuh-manager.shell: Flags [P.], seq 219:292, ack 1, win 502, options [nop,nop,TS val 1477300152 ecr 256358254], length 73
E..}Z[@.@.[....e.....@....H._.q......J.....
X....G.n<13>Feb 21 18:02:34 syslog-client root: Test number: 4 test message and sleep
................
18:02:34.390228 IP wazuh-manager.shell > 192.168.1.101.33600: Flags [.], ack 292, win 255, options [nop,nop,TS val 256363288 ecr 1477300152], length 0
E..4..@.@..........e...@_.q...I............
.G..X...................
^C
8 packets captured
8 packets received by filter
0 packets dropped by kernel
```

Check `archives.json` and verify if we have messages from `192.168.1.101`:

```
grep '"location":"192.168.1.101"' /var/ossec/logs/archives/archives.json
```

Set `remoted.debug=2` and check if it receives messages:

```
2022/02/21 18:00:25 wazuh-remoted[12230] syslogtcp.c:116 at HandleClient(): DEBUG: Received 75 bytes from '192.168.1.101'
2022/02/21 18:00:27 wazuh-remoted[12230] state.c:59 at rem_write_state(): DEBUG: Updating state file.
2022/02/21 18:00:30 wazuh-remoted[12230] syslogtcp.c:116 at HandleClient(): DEBUG: Received 75 bytes from '192.168.1.101'
2022/02/21 18:00:31 wazuh-remoted[12230] secure.c:314 at rem_keyupdate_main(): DEBUG: Checking for keys file changes.
2022/02/21 18:00:32 wazuh-remoted[12230] state.c:59 at rem_write_state(): DEBUG: Updating state file.
2022/02/21 18:00:32 wazuh-remoted[12230] manager.c:677 at c_files(): DEBUG: Updating shared files sums.
2022/02/21 18:00:32 wazuh-remoted[12230] manager.c:912 at c_files(): DEBUG: End updating shared files sums.
2022/02/21 18:00:35 wazuh-remoted[12230] syslogtcp.c:116 at HandleClient(): DEBUG: Received 75 bytes from '192.168.1.101'
2022/02/21 18:00:37 wazuh-remoted[12230] state.c:59 at rem_write_state(): DEBUG: Updating state file.
2022/02/21 18:00:40 wazuh-remoted[12230] syslogtcp.c:116 at HandleClient(): DEBUG: Received 75 bytes from '192.168.1.101'
```

## Notes

If we restart the manager we see a batch of events coming through, but this only lasts a couple of seconds and after that we don't see any other messages.

This was properly working on Wazuh 4.1.5
