### ISSUE TITLE
My Fortigate sends Syslog UDP packets and they are received by Wazuh Manager container but I do not see them in Dashboard

### ISSUE THREAD

**Issue by TheImpossibleJob** [wazuh/wazuh#30971]
Hello experts,

I am a noobie in dockers/containers and I have installed Wazuh containers on my Synology NAS using dockers in Single-node. everything is working fine, I tested Wazuh agent on my Mac OS and it works fine.

My issue is that, I configured my Fortigate firewall to send syslogs to my Wazuh Manager container and I confirmed that I can see the UDP 514 packets in the container itself (and NAS before that obviously!) but for some reason I cannot see syslogs in Wazuh dashboard although I have configured the ossec.conf file in the container which is mounted as volume as follows:

```
# docker inspect single-node-wazuh.manager-1 | grep -A 100 Mounts
          {
                "Type": "bind",
                "Source": "/volume1/docker/wazuh-docker/single-node/config/wazuh_cluster/wazuh_manager.conf",
                "Destination": "/wazuh-config-mount/etc/ossec.conf",
                "Mode": "rw",
                "RW": true,
                "Propagation": "rprivate"
            },
```

The wazuh_manager.conf has the following syslog related configuration:

```
#  cat wazuh_manager.conf
<ossec_config>
  <localfile>
    <log_format>syslog</log_format>
    <location>/var/ossec/logs/active-responses.log</location>
  </localfile>
</ossec_config>

----------

```

```
  <remote>
    <connection>syslog</connection>
    <port>514</port>
    <protocol>tcp,udp</protocol>
    <allowed-ips>192.168.2.0/24</allowed-ips>
    <local_ip>192.168.2.112 _<My NAS IP>_</local_ip>
  </remote>
```

Network settings in container: 

"Gateway": "192.168.32.1",
"IPAddress": "192.168.32.3",

Tcpdump on NAS and Wazuh Manager container:

```
NAS:

23:21:34.914852 eth1  In  IP 192.168.2.1.14718 > 192.168.2.112.514: SYSLOG local7.notice, length: 672
23:21:36.314849 eth1  In  IP 192.168.2.1.14718 > 192.168.2.112.514: SYSLOG local7.notice, length: 690
23:21:36.314877 eth1  In  IP 192.168.2.1.14718 > 192.168.2.112.514: SYSLOG local7.notice, length: 730
23:21:36.314881 eth1  In  IP 192.168.2.1.14718 > 192.168.2.112.514: SYSLOG local7.notice, length: 714
```

```
Wazuh manager container:

20:21:35.945413 eth0  In  IP 192.168.32.1.42102 > 192.168.32.3.syslog: SYSLOG local7.notice, length: 672
20:21:36.315167 eth0  In  IP 192.168.32.1.45597 > 192.168.32.3.syslog: SYSLOG local7.notice, length: 690
20:21:36.315255 eth0  In  IP 192.168.32.1.45597 > 192.168.32.3.syslog: SYSLOG local7.notice, length: 730
20:21:36.315269 eth0  In  IP 192.168.32.1.45597 > 192.168.32.3.syslog: SYSLOG local7.notice, length: 714
```

In the container, it is not listening on port UDP port 514, only on 1514:

> bash-5.2# netstat -anp | grep 514  | grep udp
> udp        0      0 0.0.0.0:1514            0.0.0.0:*  
                         -

Please let me know how I can solve this. Appreciate your help!

**Comment by matigarciadev** [comment]
Hello TheImpossibleJob,

Here are the key checks to run and the recommended configuration for your setup.

### Check the listener (inside the Wazuh container)

```bash
ss -H -lunp | egrep ':(514|1514)\b'   # UDP
ss -H -ltnp | egrep ':(514|1514)\b'   # TCP
```

If 514 isn’t there, it’s a config issue (not networking).

### Fix the config for syslog (avoid `<local_ip>`)

Use **one `<remote>` block per protocol**. Also, make sure `allowed-ips` includes the FortiGate (or its subnet).
```xml
<remote>
  <connection>syslog</connection>
  <port>514</port>
  <protocol>udp</protocol>
  <allowed-ips>FORTI_IP_OR_CIDR</allowed-ips>
</remote>
```

If you also need TCP, duplicate the block and set `<protocol>tcp</protocol>`.

**Important about `<local_ip>`**: You usually don’t need it. If you **omit** it, Wazuh listens on **all interfaces**. If you *must* set it (restricted bind), use the **container’s IP**, **not** the NAS/host IP.

### Publish ports in Docker
Expose `514/udp` (and `514/tcp` if you enabled the TCP block). Keep `1514/tcp`/`udp` for agents as usual.

### Send a quick test
Run these from the host or any machine within `allowed-ips`

**UDP**
```bash
echo "<14>$(date '+%b %d %T') testhost testproc: this is a test message (UDP)" | nc -u -w1 <HOST_IP> 514
```

**TCP**
```bash
printf "<14>$(date '+%b %d %T') testhost testproc: this is a test message (TCP)\n" | nc <HOST_IP> 514
```


### Enable archives.json
If you want to *see exactly what arrived* even when no rule fires, enable archives in JSON.

**Config** (inside `ossec.conf`):
```xml
<ossec_config>
  <global>
    <logall_json>yes</logall_json>
  </global>
</ossec_config>
```

Then restart the manager and check file: `/var/ossec/logs/archives/archives.json`, and use the index pattern `wazuh-archives-*` in Discover to view the raw events.

**Comment by juliancnn** [comment]
Closed due to inactivity,
