### ISSUE TITLE
Wazuh-maild error 

### ISSUE THREAD

**Issue by BPJOHN1990** [wazuh/wazuh#15825]
Hi all,

I am facing some issues using aspmx.l.google.com to send email alerts to myself.

I have grepped error in the /var/ossec/logs/ossec.log and below is the error that I am receiving.
...
2023/01/04 08:05:34 wazuh-maild: ERROR: (1767): End of DATA not accepted by server
2023/01/04 08:05:34 wazuh-maild: ERROR: (1223): Error Sending email to 173.194.202.26 (smtp server)
...

My ossec.config is as follows:
<ossec_config>
  <global>
    <jsonout_output>yes</jsonout_output>
    <alerts_log>yes</alerts_log>
    <logall>yes</logall>
    <logall_json>no</logall_json>
    <email_notification>yes</email_notification>
    <smtp_server>aspmx.l.google.com</smtp_server>
    <email_from>wazuh@xxx.com</email_from>
    <email_to>xxx@xxx.com</email_to>
    <email_maxperhour>10</email_maxperhour>
    <email_log_source>alerts.log</email_log_source>
    <agents_disconnection_time>10m</agents_disconnection_time>
    <agents_disconnection_alert_time>0</agents_disconnection_alert_time>
  </global>

  <alerts>
    <log_alert_level>3</log_alert_level>
    <email_alert_level>3</email_alert_level>
  </alerts>
...

I am currently on Wazuh version: 4.3.10 App revision: 4311

Any help is appreciated.

**Comment by jotacarma90** [comment]
Hello @BPJOHN1990 

I have been investigating possible causes of this error. I have found some points that we should check in depth:

- You can check this guide from our documentation in case it is an authentication problem with your SMTP: https://documentation.wazuh.com/current/user-manual/manager/manual-email-report/smtp-authentication.html
In the sixth step, you can see that there is a way to test the emails.

- More info related from google support: https://support.google.com/a/answer/176600?hl=en

- You can check the system logs to see if there are any extra clues as to what might be going on: /var/log/syslog.log

- The `dmesg` command may also be useful.

Send me any error information you find with these steps, I hope I can fix the problem as soon as possible.

Best regards,
Jose

**Comment by BPJOHN1990** [comment]
Hi @jotacarma90,

Thanks for assisting. 

For Point 1 & 2 -  I am using aspmx.l.google.com so there is no authentication. Previously my Wazuh was sending out email alerts just fine, I can't exactly recall when it stopped sending, either a month ago or 2 months ago. Do I have to set up a SMTP relay using postfix despite using Option 3: Send email with the restricted Gmail SMTP server? Because it was working fine previously.

For Point 3 - I can't seem to locate /var/log/syslog.log. 

For point 4 - my dmesg seems fine. There wasn't much error information.

**Comment by jotacarma90** [comment]
Hello @BPJOHN1990 
I am seeing the same error (ERROR: (1767)), this means that the internal option strict_checking had no effect in disabling it. Wazuh needs to be restarted to apply a setting correctly.
Can you repeat the process after reboot?

**Comment by BPJOHN1990** [comment]
Hi @jotacarma90,

Apologies, refer to the below output.
...
2023/01/10 02:02:27 wazuh-logcollector: INFO: Monitoring output of command(360): df -P
2023/01/10 02:02:27 wazuh-logcollector: INFO: Monitoring full output of command(360): netstat -tulpn | sed 's/\([[:alnum:]]\+\)\ \+[[:digit:]]\+\ \+[[:digit:]]\+\ \+\(.*\):\([[:digit:]]*\)\ \+\([0-9\.\:\*]\+\).\+\ \([[:digit:]]*\/[[:alnum:]\-]*\).*/\1 \2 == \3 == \4 \5/' | sort -k 4 -g | sed 's/ == \(.*\) ==/:\1/' | sed 1,2d
2023/01/10 02:02:27 wazuh-logcollector: INFO: Monitoring full output of command(360): last -n 20
2023/01/10 02:02:27 wazuh-logcollector: INFO: (1950): Analyzing file: '/var/log/audit/audit.log'.
2023/01/10 02:02:27 wazuh-logcollector: INFO: (1950): Analyzing file: '/var/ossec/logs/active-responses.log'.
2023/01/10 02:02:27 wazuh-logcollector: INFO: (1950): Analyzing file: '/var/log/messages'.
2023/01/10 02:02:27 wazuh-logcollector: INFO: (1950): Analyzing file: '/var/log/secure'.
2023/01/10 02:02:27 wazuh-logcollector: INFO: (1950): Analyzing file: '/var/log/maillog'.
2023/01/10 02:02:27 wazuh-logcollector: INFO: Started (pid: 2850).
2023/01/10 02:02:28 wazuh-monitord: INFO: Started (pid: 2874).
2023/01/10 02:02:29 wazuh-modulesd: INFO: Started (pid: 2895).
2023/01/10 02:02:29 wazuh-modulesd:agent-upgrade: INFO: (8153): Module Agent Upgrade started.
2023/01/10 02:02:29 wazuh-modulesd:ciscat: INFO: Module disabled. Exiting...
2023/01/10 02:02:29 wazuh-modulesd:osquery: INFO: Module disabled. Exiting...
2023/01/10 02:02:29 sca: INFO: Module disabled. Exiting.
2023/01/10 02:02:29 wazuh-modulesd:database: INFO: Module started.
2023/01/10 02:02:29 wazuh-modulesd:download: INFO: Module started.
2023/01/10 02:02:29 wazuh-modulesd:control: INFO: Starting control thread.
2023/01/10 02:02:29 wazuh-modulesd:task-manager: INFO: (8200): Module Task Manager started.
2023/01/10 02:02:29 wazuh-modulesd:syscollector: INFO: Module started.
2023/01/10 02:02:29 wazuh-modulesd:syscollector: INFO: Starting evaluation.
2023/01/10 02:02:34 wazuh-syscheckd: INFO: (6009): File integrity monitoring scan ended.
2023/01/10 02:02:36 wazuh-modulesd:syscollector: INFO: Evaluation finished.
2023/01/10 01:28:49 rootcheck: INFO: Ending rootcheck scan.
2023/01/10 01:29:12 wazuh-maild[4256] debug_op.c:70 at _log(): DEBUG: Logging module auto-initialized
2023/01/10 01:29:12 wazuh-maild[4256] maild.c:196 at main(): DEBUG: Chrooted to directory: /var/ossec, using user: wazuh
2023/01/10 01:29:12 wazuh-maild[4256] maild.c:204 at main(): DEBUG: Chrooted to directory: /var/ossec, using user: wazuh
2023/01/10 01:29:12 wazuh-maild[4256] mailcom.c:102 at mailcom_main(): DEBUG: Local requests thread ready
2023/01/10 01:29:12 wazuh-maild[4256] maild.c:219 at main(): INFO: Started (pid: 4256).
2023/01/10 01:29:12 wazuh-maild[4256] maild.c:258 at OS_Run(): INFO: Getting alerts in log format.
[root@wazuh-server ~]# tail /var/ossec/logs/ossec.log
2023/01/10 02:02:29 wazuh-modulesd:syscollector: INFO: Starting evaluation.
2023/01/10 02:02:34 wazuh-syscheckd: INFO: (6009): File integrity monitoring scan ended.
2023/01/10 02:02:36 wazuh-modulesd:syscollector: INFO: Evaluation finished.
2023/01/10 01:28:49 rootcheck: INFO: Ending rootcheck scan.
2023/01/10 01:29:12 wazuh-maild[4256] debug_op.c:70 at _log(): DEBUG: Logging module auto-initialized
2023/01/10 01:29:12 wazuh-maild[4256] maild.c:196 at main(): DEBUG: Chrooted to directory: /var/ossec, using user: wazuh
2023/01/10 01:29:12 wazuh-maild[4256] maild.c:204 at main(): DEBUG: Chrooted to directory: /var/ossec, using user: wazuh
2023/01/10 01:29:12 wazuh-maild[4256] mailcom.c:102 at mailcom_main(): DEBUG: Local requests thread ready
2023/01/10 01:29:12 wazuh-maild[4256] maild.c:219 at main(): INFO: Started (pid: 4256).
2023/01/10 01:29:12 wazuh-maild[4256] maild.c:258 at OS_Run(): INFO: Getting alerts in log format.
...

**Comment by jotacarma90** [comment]
Thank you very much!
Have you been able to see any email alerts? It would also be necessary to force an event that generates an alert. This way we can get more information if there is a problem with the messages!

**Comment by BPJOHN1990** [comment]
Hi @jotacarma90,

I am afraid not. I am still not receiving any alerts. I have even set my email alerts to level 3 but still not receiving any email alerts. 

<html>
<body>


@timestamp | 2023-01-11T00:57:59.865Z
-- | --
  | _id | yyJVnoUBiIhEtWADjWn4
  | agent.id | 000
  | agent.name | wazuh-server
  | data.dstuser | root
  | data.srcuser | wazuh-user
  | data.uid | 0
  | decoder.name | pam
  | decoder.parent | pam
  | full_log | Jan 11 00:57:58 wazuh-server su: pam_unix(su-l:session): session opened for user root by wazuh-user(uid=0)
  | id | 1673398679.42487
  | input.type | log
  | location | /var/log/secure
  | manager.name | wazuh-server
  | predecoder.hostname | wazuh-server
  | predecoder.program_name | su
  | predecoder.timestamp | Jan 11 00:57:58
  | rule.description | PAM: Login session opened.
  | rule.firedtimes | 3
  | rule.gdpr | IV_32.2
  | rule.gpg13 | 7.8, 7.9
  | rule.groups | pam, syslog, authentication_success
  | rule.hipaa | 164.312.b
  | rule.id | 5501
  | rule.level | 3
  | rule.mail | true
  | rule.mitre.id | T1078
  | rule.mitre.tactic | Defense Evasion, Persistence, Privilege Escalation, Initial Access
  | rule.mitre.technique | Valid Accounts
  | rule.nist_800_53 | AU.14, AC.7
  | rule.pci_dss | 10.2.5
  | rule.tsc | CC6.8, CC7.2, CC7.3
  | timestamp | 2023-01-11T00:57:59.865+0000


</body>
</html>

**Comment by jotacarma90** [comment]
Well, it seems that there is a problem with the server when sending the messages, since we are not receiving them correctly.

I am thinking about what may have caused this configuration to work for you for some time, but suddenly it stopped working.
How long was it working for? You don't remember any substantial changes that might have affected it?

It occurs to me to check with the `tcpdump` command to see if you see any related errors that would give us more information.

Lastly, could you try Option 3 found on google support that I told you about?
https://support.google.com/a/answer/176600?hl=en

**Comment by BPJOHN1990** [comment]
Hi @jotacarma90,

It was working for a couple of months before it suddenly died last year, I think June 2022. It was working fine for a couple of months. No changes was done to Wazuh as only I have the access to it.

As for Option 3, no changes were done to our end as well.

For tcpdump, any advise on what to lookout for?

**Comment by BPJOHN1990** [comment]
@jotacarma90,

Hi, I have just rechecked the Gsuite setting, I even whitelisted all emails in Gsuite SPF records to allow. (I did a telnet test to aspmx.l.google.com and manually crafted an email and I can receive it.) Are there any other solutions? For tcpdump, any advise what I am looking for?

**Comment by jotacarma90** [comment]
Hello @BPJOHN1990 
Sorry for the delay, I have tried to reproduce the problem but have not found any way to get to that error.

Seems rather strange since it got to be working for a while. 
Also nothing changed related to the type of emails being sent?
There may be more info in the system mail logs, you can check, they are usually these files:

```
/var/log/maillog
/var/log/mail.log
/var/adm/maillog
/var/adm/syslog/mail.log
```

Any leads could be useful

**Comment by BPJOHN1990** [comment]
@jotacarma90,

Sorry for the delayed replies. Do you recommend me to re-setup Wazuh all over again for this issue? Because no config changes were done, but have just stopped working suddenly. 

As for var/log/maillog -> Empty result
cat: /var/log/mail.log: No such file or directory
cat: /var/adm/maillog: No such file or directory
cat: var/adm/syslog/mail.log: No such file or directory

**Comment by BPJOHN1990** [comment]
Hi @jotacarma90 

Tried the command _tcpdump host aspmx.l.google.com_ and generated some alerts but no tcpdump traffic was captured were coming back.

The link you provided seems like its down?

**Comment by aszerman** [comment]
Hello! we have the same problem here, using GMAIL relay setup.

**Comment by aszerman** [comment]
UPDATE:

After doing a tcpdump well, we can see that we have reach the relay sending limit:

# tcpdump -vvv host 142.251.163.28
tcpdump: listening on eth0, link-type EN10MB (Ethernet), capture size 262144 bytes


21:15:22.793055 IP (tos 0x0, ttl 255, id 16478, offset 0, flags [DF], proto TCP (6), length 60)
    wazuh-manager-master-0.wazuh-cluster.siem.svc.cluster.local.47678 > wv-in-f28.1e100.net.smtp: Flags [S], cksum 0x55d1 (incorrect -> 0xcb47), seq 379469379, win 62727, options [mss 8961,sackOK,TS val 1127268951 ecr 0,nop,wscale 7], length 0
21:15:22.795395 IP (tos 0x0, ttl 114, id 0, offset 0, flags [DF], proto TCP (6), length 60)
    wv-in-f28.1e100.net.smtp > wazuh-manager-master-0.wazuh-cluster.siem.svc.cluster.local.47678: Flags [S.], cksum 0xb201 (correct), seq 125636292, ack 379469380, win 65535, options [mss 1412,sackOK,TS val 1792125606 ecr 1127268951,nop,wscale 8], length 0
21:15:22.795718 IP (tos 0x0, ttl 255, id 16479, offset 0, flags [DF], proto TCP (6), length 52)
    wazuh-manager-master-0.wazuh-cluster.siem.svc.cluster.local.47678 > wv-in-f28.1e100.net.smtp: Flags [.], cksum 0x55c9 (incorrect -> 0xdeb1), seq 1, ack 1, win 491, options [nop,nop,TS val 1127268953 ecr 1792125606], length 0
21:15:22.854473 IP (tos 0x0, ttl 114, id 53318, offset 0, flags [none], proto TCP (6), length 143)
    wv-in-f28.1e100.net.smtp > wazuh-manager-master-0.wazuh-cluster.siem.svc.cluster.local.47678: Flags [P.], cksum 0xbcd3 (correct), seq 1:92, ack 1, win 256, options [nop,nop,TS val 1792125665 ecr 1127268953], length 91: SMTP, length: 91
	220 smtp-relay.gmail.com ESMTP b6-20020a170902d88600b001967d95881csm1165800plz.51 - gsmtp
21:15:22.854526 IP (tos 0x0, ttl 255, id 16480, offset 0, flags [DF], proto TCP (6), length 52)
    wazuh-manager-master-0.wazuh-cluster.siem.svc.cluster.local.47678 > wv-in-f28.1e100.net.smtp: Flags [.], cksum 0x55c9 (incorrect -> 0xdde0), seq 1, ack 92, win 491, options [nop,nop,TS val 1127269012 ecr 1792125665], length 0
21:15:22.854611 IP (tos 0x0, ttl 255, id 16481, offset 0, flags [DF], proto TCP (6), length 75)
    wazuh-manager-master-0.wazuh-cluster.siem.svc.cluster.local.47678 > wv-in-f28.1e100.net.smtp: Flags [P.], cksum 0x55e0 (incorrect -> 0x83fb), seq 1:24, ack 92, win 491, options [nop,nop,TS val 1127269012 ecr 1792125665], length 23: SMTP, length: 23
	Helo notify.ossec.net
21:15:22.856592 IP (tos 0x0, ttl 114, id 53319, offset 0, flags [none], proto TCP (6), length 52)
    wv-in-f28.1e100.net.smtp > wazuh-manager-master-0.wazuh-cluster.siem.svc.cluster.local.47678: Flags [.], cksum 0xdeb2 (correct), seq 92, ack 24, win 256, options [nop,nop,TS val 1792125667 ecr 1127269012], length 0
21:15:22.913870 IP (tos 0x0, ttl 114, id 53320, offset 0, flags [none], proto TCP (6), length 94)
    wv-in-f28.1e100.net.smtp > wazuh-manager-master-0.wazuh-cluster.siem.svc.cluster.local.47678: Flags [P.], cksum 0x0c95 (correct), seq 92:134, ack 24, win 256, options [nop,nop,TS val 1792125724 ecr 1127269012], length 42: SMTP, length: 42
	250 smtp-relay.gmail.com at your service
21:15:22.913916 IP (tos 0x0, ttl 255, id 16482, offset 0, flags [DF], proto TCP (6), length 52)
    wazuh-manager-master-0.wazuh-cluster.siem.svc.cluster.local.47678 > wv-in-f28.1e100.net.smtp: Flags [.], cksum 0x55c9 (incorrect -> 0xdd28), seq 24, ack 134, win 491, options [nop,nop,TS val 1127269072 ecr 1792125724], length 0
21:15:22.913981 IP (tos 0x0, ttl 255, id 16483, offset 0, flags [DF], proto TCP (6), length 81)
    wazuh-manager-master-0.wazuh-cluster.siem.svc.cluster.local.47678 > wv-in-f28.1e100.net.smtp: Flags [P.], cksum 0x55e6 (incorrect -> 0x012e), seq 24:53, ack 134, win 491, options [nop,nop,TS val 1127269072 ecr 1792125724], length 29: SMTP, length: 29
	Mail From: <alerts@customar.io>
21:15:22.915895 IP (tos 0x0, ttl 114, id 53321, offset 0, flags [none], proto TCP (6), length 52)
    wv-in-f28.1e100.net.smtp > wazuh-manager-master-0.wazuh-cluster.siem.svc.cluster.local.47678: Flags [.], cksum 0xddf3 (correct), seq 134, ack 53, win 256, options [nop,nop,TS val 1792125727 ecr 1127269072], length 0
21:15:22.981112 IP (tos 0x0, ttl 114, id 53322, offset 0, flags [none], proto TCP (6), length 125)
    wv-in-f28.1e100.net.smtp > wazuh-manager-master-0.wazuh-cluster.siem.svc.cluster.local.47678: Flags [P.], cksum 0x1f8a (correct), seq 134:207, ack 53, win 256, options [nop,nop,TS val 1792125792 ecr 1127269072], length 73: SMTP, length: 73
	250 2.1.0 OK b6-20020a170902d88600b001967d95881csm1165800plz.51 - gsmtp
21:15:22.981245 IP (tos 0x0, ttl 255, id 16484, offset 0, flags [DF], proto TCP (6), length 52)
    wazuh-manager-master-0.wazuh-cluster.siem.svc.cluster.local.47678 > wv-in-f28.1e100.net.smtp: Flags [.], cksum 0x55c9 (incorrect -> 0xdc3b), seq 53, ack 207, win 491, options [nop,nop,TS val 1127269139 ecr 1792125792], length 0
21:15:22.981301 IP (tos 0x0, ttl 255, id 16485, offset 0, flags [DF], proto TCP (6), length 86)
    wazuh-manager-master-0.wazuh-cluster.siem.svc.cluster.local.47678 > wv-in-f28.1e100.net.smtp: Flags [P.], cksum 0x55eb (incorrect -> 0xb360), seq 53:87, ack 207, win 491, options [nop,nop,TS val 1127269139 ecr 1792125792], length 34: SMTP, length: 34
	Rcpt To: <seginfo@customer.com>
21:15:22.983232 IP (tos 0x0, ttl 114, id 53323, offset 0, flags [none], proto TCP (6), length 52)
    wv-in-f28.1e100.net.smtp > wazuh-manager-master-0.wazuh-cluster.siem.svc.cluster.local.47678: Flags [.], cksum 0xdd02 (correct), seq 207, ack 87, win 256, options [nop,nop,TS val 1792125794 ecr 1127269139], length 0
21:15:23.038575 IP (tos 0x0, ttl 114, id 53324, offset 0, flags [none], proto TCP (6), length 125)
    wv-in-f28.1e100.net.smtp > wazuh-manager-master-0.wazuh-cluster.siem.svc.cluster.local.47678: Flags [P.], cksum 0x19a3 (correct), seq 207:280, ack 87, win 256, options [nop,nop,TS val 1792125849 ecr 1127269139], length 73: SMTP, length: 73
	250 2.1.5 OK b6-20020a170902d88600b001967d95881csm1165800plz.51 - gsmtp
21:15:23.038677 IP (tos 0x0, ttl 255, id 16486, offset 0, flags [DF], proto TCP (6), length 58)
    wazuh-manager-master-0.wazuh-cluster.siem.svc.cluster.local.47678 > wv-in-f28.1e100.net.smtp: Flags [P.], cksum 0x55cf (incorrect -> 0x35c4), seq 87:93, ack 280, win 491, options [nop,nop,TS val 1127269196 ecr 1792125849], length 6: SMTP, length: 6
	DATA
21:15:23.040643 IP (tos 0x0, ttl 114, id 53325, offset 0, flags [none], proto TCP (6), length 52)
    wv-in-f28.1e100.net.smtp > wazuh-manager-master-0.wazuh-cluster.siem.svc.cluster.local.47678: Flags [.], cksum 0xdc41 (correct), seq 280, ack 93, win 256, options [nop,nop,TS val 1792125851 ecr 1127269196], length 0
21:15:23.097020 IP (tos 0x0, ttl 114, id 53326, offset 0, flags [none], proto TCP (6), length 339)
    wv-in-f28.1e100.net.smtp > wazuh-manager-master-0.wazuh-cluster.siem.svc.cluster.local.47678: Flags [P.], cksum 0xca66 (correct), seq 280:567, ack 93, win 256, options [nop,nop,TS val 1792125908 ecr 1127269196], length 287: SMTP, length: 287
	550-5.7.1 Daily SMTP relay limit exceeded for customer. For more information on
	550-5.7.1 SMTP relay sending limits please contact your administrator or visit
	550 5.7.1  https://support.google.com/a/answer/6140680#dailylimit b6-20020a170902d88600b001967d95881csm1165800plz.51 - gsmtp
21:15:23.097592 IP (tos 0x0, ttl 255, id 16487, offset 0, flags [DF], proto TCP (6), length 52)
    wazuh-manager-master-0.wazuh-cluster.siem.svc.cluster.local.47678 > wv-in-f28.1e100.net.smtp: Flags [F.], cksum 0x55c9 (incorrect -> 0xd9c4), seq 93, ack 567, win 489, options [nop,nop,TS val 1127269255 ecr 1792125908], length 0
21:15:23.104627 IP (tos 0x0, ttl 114, id 53327, offset 0, flags [none], proto TCP (6), length 52)
    wv-in-f28.1e100.net.smtp > wazuh-manager-master-0.wazuh-cluster.siem.svc.cluster.local.47678: Flags [.], cksum 0xdaa6 (correct), seq 567, ack 94, win 256, options [nop,nop,TS val 1792125915 ecr 1127269255], length 0
21:15:23.154832 IP (tos 0x0, ttl 114, id 53328, offset 0, flags [none], proto TCP (6), length 52)
    wv-in-f28.1e100.net.smtp > wazuh-manager-master-0.wazuh-cluster.siem.svc.cluster.local.47678: Flags [F.], cksum 0xda73 (correct), seq 567, ack 94, win 256, options [nop,nop,TS val 1792125965 ecr 1127269255], length 0
21:15:23.154878 IP (tos 0x0, ttl 255, id 0, offset 0, flags [DF], proto TCP (6), length 52)
    wazuh-manager-master-0.wazuh-cluster.siem.svc.cluster.local.47678 > wv-in-f28.1e100.net.smtp: Flags [.], cksum 0xd950 (correct), seq 94, ack 568, win 489, options [nop,nop,TS val 1127269313 ecr 1792125965], length 0

**Comment by BPJOHN1990** [comment]
@aszerman Glad to know that its not my organization email rules blocking. I am however, not using Gmail relay. I tried manual crafting of email via telnet and my email works and can be received. Something weird is going on here. 

@jotacarma90 Is there any updates regarding this? Thanks in advance
