### ISSUE TITLE
Syslog problem

### ISSUE THREAD

**Issue by brickwall1** [wazuh/wazuh#4320]
Hello,

I have arhitecture like wazuh manager, then logstash, then elasticsearch, then kibana.
Normally i have normally registered agents, but now i want to add syslog.
I set typical port in remote for syslog and i added allowed ip's. I see on tcdump that i received some syslogs, but i can't find them in Discovery in Kibana.

**Comment by Zenidd** [comment]
Hello @brickwall1,

> I set typical port in remote for syslog and i added allowed ip's. I see on tcdump that i received some syslogs, but i can't find them in Discovery in Kibana.

It's great that you've made sure the logs from Syslog are reaching the manager. This speeds up the problem resolution. 

Usually, when the events are arriving at the manager but don't show up in the discovery Kibana tab, decoders or rules are missing. That's why we need to check these events format and create the needed ruleset elements.

To check the format of the events, you should enable the `<logall>yes</logall>` option in the manager `ossec.conf` file, which allows you to store all the incoming logs wether they trip a decoder/rule or not into `/var/ossec/logs/archives/archives.log`.

 Once you do that, and after restarting the Wazuh manager, all the incoming logs should be archived at `/var/ossec/logs/archives/archives.log`. I would like you to pick several examples of your Syslog logs from the archives.log file and paste them here; this way I can help you with the needed custom decoders/rules. You can use the `/var/ossec/bin/ossec-logtest` binary as help to debug custom decoders/rules. It allows you to input a log line and check what decoders and rules are triggered. 

Let me know how it goes. Greetings, 
JP Sáez

**Comment by brickwall1** [comment]
one example is : 2019 Dec 03 13:35:43 barracuda->10.0.4.102 Dec  3 13:35:43 barracuda 2019-12-03 13:35:43.536 +0100  barracuda TR 172.16.10.230 443 46.248.163.14 46908 "-" "-" POST TLSv1.2 wbs-p.uniqa.pl HTTP/1.1 200 32012 15720 0 3101 172.16.10.235 9990 3101 "-" SERVER DEFAULT PASSIVE VALID /PosInetPortlets/CalculatePolicyServiceEndpoint "-" "-" "-" "HTTPClient/1.0 (2.8.2.3, ruby 2.3.6 (2017-12-14))" 46.248.163.14 46908 "-" "-" "-" "-"

**Comment by Zenidd** [comment]
Hi again @brickwall1,

I already wrote the custom decoders but there is one issue that I need you to solve on your side. In your example log the date is duplicated. It shouldn't be a problem but:

`Dec 3 13:35:43` barracuda `2019-12-03 13:35:43.536 +0100` barracuda TR 172.16.10.230 443 46.248.163.14 46908..........

The first date is messing with the decoding process:
- `Dec X 13:35:43` dates with one digit for the day work well.
- `Dec XX 13:35:43` dates with two digits for the day make the internal decoder trigger and it messes with the custom decoder I wrote.

I would like you to remove that first date from the log format so it allows the decoder to work correctly. You could check [this barracuda documentation section](https://campus.barracuda.com/product/webapplicationfirewall/doc/4259935/how-to-configure-syslog-and-other-logs/) about changing the log format. These are examples of valid log formats:


```
example 1
 2019 Dec 03 13:35:43 barracuda->10.0.4.102 2019-12-03 13:35:43.536 +0100 barracuda TR 172.16.10.230 443 46.248.163.14 46908 "-" "-" POST TLSv1.2 wbs-p.uniqa.pl HTTP/1.1 200 32012 15720 0 3101 172.16.10.235 9990 3101 "-" SERVER DEFAULT PASSIVE VALID /PosInetPortlets/CalculatePolicyServiceEndpoint "-" "-" "-" "HTTPClient/1.0 (2.8.2.3, ruby 2.3.6 (2017-12-14))" 46.248.163.14 46908 "-" "-" "-" "-"

example 1
 : 2019 Dec 03 13:35:43 barracuda->10.0.4.102 barracuda 2019-12-03 13:35:43.536 +0100 barracuda TR 172.16.10.230 443 46.248.163.14 46908 "-" "-" POST TLSv1.2 wbs-p.uniqa.pl HTTP/1.1 200 32012 15720 0 3101 172.16.10.235 9990 3101 "-" SERVER DEFAULT PASSIVE VALID /PosInetPortlets/CalculatePolicyServiceEndpoint "-" "-" "-" "HTTPClient/1.0 (2.8.2.3, ruby 2.3.6 (2017-12-14))" 46.248.163.14 46908 "-" "-" "-" "-"

```
Greetings, JP Sáez

**Comment by brickwall1** [comment]
Unfortunatelly Dec 3 13:35:43 cant be remove.

(Can you also remove domain name from previous comment (i forgot to remove it).

Generally, i see messages on syslog port but later i can't find enything in alerts.json after exfiltrating windows events. So my conclusion is that it don't reach wazuh.

**Comment by brickwall1** [comment]
Another few examples from tcpdump:

<134>Dec  5 13:33:50 barracuda 2019-12-05 13:33:50.666 +0100  HTTPS 35.198.82.185 51870 172.16.10.230 47873 172.16.10.235 1575
................
13:33:50.332144 IP 10.0.4.102.35337 > <mydomain>.syslog: SYSLOG local0.info, length: 128
.........4......E....P@.@.R.
..f
....    ......<134>Dec  5 13:33:50 barracuda 2019-12-05 13:33:50.690 +0100  HTTPS 35.198.82.185 51866 172.16.10.230 47873 172.16.10.235 1575
................
13:33:50.355950 IP 10.0.4.102.35337 > <mydomain>.syslog: SYSLOG local0.info, length: 128
.........4......E....T@.@.R.
..f
....    .....
<134>Dec  5 13:33:50 barracuda 2019-12-05 13:33:50.714 +0100  HTTPS 35.198.82.185 51882 172.16.10.230 47873 172.16.10.235 1575
................
13:33:50.357138 IP 10.0.4.102.35337 > <mydomain>.syslog: SYSLOG local0.info, length: 128
.........4......E....U@.@.R.
..f
....    ......<134>Dec  5 13:33:50 barracuda 2019-12-05 13:33:50.715 +0100  HTTPS 35.198.82.185 51868 172.16.10.230 47873 172.16.10.235 1575
................
13:33:50.370230 IP 10.0.4.102.35337 > <mydomain>.syslog: SYSLOG local0.info, length: 128
.........4......E....V@.@.R.
..f
....    ......<134>Dec  5 13:33:50 barracuda 2019-12-05 13:33:50.728 +0100  HTTPS 35.198.82.185 51862 172.16.10.230 47873 172.16.10.235 1575
................
13:33:50.380598 IP 10.0.4.102.35337 > <mydomain>.syslog: SYSLOG local0.warning, length: 456
.........4......E....W@.@.Q\
..f
....    ....J.
