### ISSUE TITLE
Inconsistent rule alert with timeframe/frequency

### ISSUE THREAD

**Issue by jeffjen** [wazuh/wazuh#22590]
|Wazuh version| Component | Action type |
|---| --- | --- |
| 4.4.3 | Rules | Error |

## Description

Here is the rule in question

```xml
<rule id="107100" level="15">
  <decoded_as>tcpdump</decoded_as>
  <field name="tcpdump.srcip">\.+</field>
  <description>Network scan detected from $(tcpdump.srcip):$(tcpdump.srcport)</description>
</rule>

<rule id="107101" level="15" frequency="2" timeframe="180">
  <if_matched_sid>107100</if_matched_sid>
  <same_field>tcpdump.srcip</same_field>
  <same_field>tcpdump.dstip</same_field>
  <description>Network scan detected from $(tcpdump.srcip):$(tcpdump.srcport)</description>
</rule>
```

My expectation is -

1. First message triggers **#107100**
2. Repeat message from same field `tcpdump.srcip` and `tcpdump.dstip` triggers **#107101**
3. **#107100** will not be trigger until 180s defined in timeframe has passed

In wazuh-logtest
1. Works as exepcted

In wazuh manager
1. **#107101** does not get triggered, and we see **#107100** triggers multiple times in the timeframe

A similar problem is seen here https://groups.google.com/g/wazuh/c/rC4TqOfHVDQ.  OP reported that their rule is able to be verified in `wazuh-logtest` but not after rule deployment.

Please do not argue whether or not the logtest works (cause I know it works). The issue is with when many events hit Wazuh Manager at once in a real world situation.

### Service/Product/Module

N/A

### Current results

Wazuh logtest is able to correctly interpret the rule, while the manager even after multiple restarts mis-handles timeframe and frequency condition

### Expected results

1. First message triggers **#107100**
3. Repeat message from same field `tcpdump.srcip` and `tcpdump.dstip` triggers **#107101**
4. **#107100** will not be trigger until 180s defined in timeframe has passed

### Log source / integration

N/A

### Log reference

N/A 

### Log examples

Log line to test with `wazuh-logtest`

```
Dec 12 04:45:12 ip-10-79-72-63 sensor-tcpdump: 04:45:03.354557 IP 10.79.31.91.1514 > 10.79.72.63.46218: Flags [.], ack 511, win 442, options [nop,nop,TS val 3627931504 ecr 343775185], length 0
```

Running result with `wazuh-logtest`

```
Dec 12 04:45:12 ip-10-79-72-63 sensor-tcpdump: 04:45:03.354557 IP 10.79.31.91.1514 > 10.79.72.63.46218: Flags [.], ack 511, win 442, options [nop,nop,TS val 3627931504 ecr 343775185], length 0

**Phase 1: Completed pre-decoding.
        full event: 'Dec 12 04:45:12 ip-10-79-72-63 sensor-tcpdump: 04:45:03.354557 IP 10.79.31.91.1514 > 10.79.72.63.46218: Flags [.], ack 511, win 442, options [nop,nop,TS val 3627931504 ecr 343775185], length 0'
        timestamp: 'Dec 12 04:45:12'
        hostname: 'ip-10-79-72-63'
        program_name: 'sensor-tcpdump'

**Phase 2: Completed decoding.
        name: 'tcpdump'
        tcpdump.dstip: '10.79.72.63'
        tcpdump.dstport: '46218'
        tcpdump.srcip: '10.79.31.91'
        tcpdump.srcport: '1514'

**Phase 3: Completed filtering (rules).
        id: '107100'
        level: '15'
        description: 'Network scan detected from 10.79.31.91:1514'
        groups: '['syslog', 'honeypot']'
        firedtimes: '1'
        mail: 'True'
**Alert to be generated.

Dec 12 04:45:12 ip-10-79-72-63 sensor-tcpdump: 04:45:03.354557 IP 10.79.31.91.1514 > 10.79.72.63.46218: Flags [.], ack 511, win 442, options [nop,nop,TS val 3627931504 ecr 343775185], length 0

**Phase 1: Completed pre-decoding.
        full event: 'Dec 12 04:45:12 ip-10-79-72-63 sensor-tcpdump: 04:45:03.354557 IP 10.79.31.91.1514 > 10.79.72.63.46218: Flags [.], ack 511, win 442, options [nop,nop,TS val 3627931504 ecr 343775185], length 0'
        timestamp: 'Dec 12 04:45:12'
        hostname: 'ip-10-79-72-63'
        program_name: 'sensor-tcpdump'

**Phase 2: Completed decoding.
        name: 'tcpdump'
        tcpdump.dstip: '10.79.72.63'
        tcpdump.dstport: '46218'
        tcpdump.srcip: '10.79.31.91'
        tcpdump.srcport: '1514'

**Phase 3: Completed filtering (rules).
        id: '107101'
        level: '15'
        description: 'Network scan detected from 10.79.31.91:1514'
        groups: '['syslog', 'honeypot']'
        firedtimes: '1'
        frequency: '2'
        mail: 'True'
**Alert to be generated.

Dec 12 04:45:12 ip-10-79-72-63 sensor-tcpdump: 04:45:03.354557 IP 10.79.31.91.1514 > 10.79.72.63.46218: Flags [.], ack 511, win 442, options [nop,nop,TS val 3627931504 ecr 343775185], length 0

**Phase 1: Completed pre-decoding.
        full event: 'Dec 12 04:45:12 ip-10-79-72-63 sensor-tcpdump: 04:45:03.354557 IP 10.79.31.91.1514 > 10.79.72.63.46218: Flags [.], ack 511, win 442, options [nop,nop,TS val 3627931504 ecr 343775185], length 0'
        timestamp: 'Dec 12 04:45:12'
        hostname: 'ip-10-79-72-63'
        program_name: 'sensor-tcpdump'

**Phase 2: Completed decoding.
        name: 'tcpdump'
        tcpdump.dstip: '10.79.72.63'
        tcpdump.dstport: '46218'
        tcpdump.srcip: '10.79.31.91'
        tcpdump.srcport: '1514'

**Phase 3: Completed filtering (rules).
        id: '107101'
        level: '15'
        description: 'Network scan detected from 10.79.31.91:1514'
        groups: '['syslog', 'honeypot']'
        firedtimes: '2'
        frequency: '2'
        mail: 'True'
**Alert to be generated.

<WAIT FOR 180s>

Dec 12 04:45:12 ip-10-79-72-63 sensor-tcpdump: 04:45:03.354557 IP 10.79.31.91.1514 > 10.79.72.63.46218: Flags [.], ack 511, win 442, options [nop,nop,TS val 3627931504 ecr 343775185], length 0

**Phase 1: Completed pre-decoding.
        full event: 'Dec 12 04:45:12 ip-10-79-72-63 sensor-tcpdump: 04:45:03.354557 IP 10.79.31.91.1514 > 10.79.72.63.46218: Flags [.], ack 511, win 442, options [nop,nop,TS val 3627931504 ecr 343775185], length 0'
        timestamp: 'Dec 12 04:45:12'
        hostname: 'ip-10-79-72-63'
        program_name: 'sensor-tcpdump'

**Phase 2: Completed decoding.
        name: 'tcpdump'
        tcpdump.dstip: '10.79.72.63'
        tcpdump.dstport: '46218'
        tcpdump.srcip: '10.79.31.91'
        tcpdump.srcport: '1514'

**Phase 3: Completed filtering (rules).
        id: '107100'
        level: '15'
        description: 'Network scan detected from 10.79.31.91:1514'
        groups: '['syslog', 'honeypot']'
        firedtimes: '2'
        mail: 'True'
**Alert to be generated.

Dec 12 04:45:12 ip-10-79-72-63 sensor-tcpdump: 04:45:03.354557 IP 10.79.31.91.1514 > 10.79.72.63.46218: Flags [.], ack 511, win 442, options [nop,nop,TS val 3627931504 ecr 343775185], length 0

**Phase 1: Completed pre-decoding.
        full event: 'Dec 12 04:45:12 ip-10-79-72-63 sensor-tcpdump: 04:45:03.354557 IP 10.79.31.91.1514 > 10.79.72.63.46218: Flags [.], ack 511, win 442, options [nop,nop,TS val 3627931504 ecr 343775185], length 0'
        timestamp: 'Dec 12 04:45:12'
        hostname: 'ip-10-79-72-63'
        program_name: 'sensor-tcpdump'

**Phase 2: Completed decoding.
        name: 'tcpdump'
        tcpdump.dstip: '10.79.72.63'
        tcpdump.dstport: '46218'
        tcpdump.srcip: '10.79.31.91'
        tcpdump.srcport: '1514'

**Phase 3: Completed filtering (rules).
        id: '107101'
        level: '15'
        description: 'Network scan detected from 10.79.31.91:1514'
        groups: '['syslog', 'honeypot']'
        firedtimes: '3'
        frequency: '2'
        mail: 'True'
**Alert to be generated.
```

### Threats and compliance

N/A

**Comment by xmlijhu** [comment]
Some new findings need to added:
This issue is only happening when there are many agents connecting to the Wazuh manager. 

If we the agent counts is less, then 107100 is triggered as expected ( about 180s); However if the agent count exceeds some value ( 1000 for example), then 107100 randomly. 

We then checked the system performance by top, we can see the wazuh-analysisd is busying ( 100%), however we have 16CPU, so the node CPU average is only 10%. Also I checked the analysisd.state file as well, no dropped events happened.

**Comment by xmlijhu** [comment]
Update:
You need to adjust the meory_size in ossec.conf to higher value in case your manager loads increase.

By default the value is 8192 which holds the number of events for correlation, increasing this value to 819200 ( or higher ) will hold more events for correlation. Be careful, the higher the number, the more memory your manager will consume.

**Comment by dlouzan** [comment]
@xmlijhu Thanks for this thread! We just realized we had the same issue, and sadly this is not explicitly stated anywhere in the documentation. In a system where a significant number of events per second is ingested, it's kind of trial error to find out why sometimes frequency-based alerts are not working properly 🙇
