### ISSUE TITLE
Develop the designed implementation for Amazon Security Lake as a subscriber

### ISSUE THREAD

**Issue by fdalmaup** [wazuh/wazuh#16407]
| Development branch |
|---|
| [feature/16407-amazon-sec-lake-dev](https://github.com/wazuh/wazuh/tree/feature/16407-amazon-sec-lake-dev) |

## Description

Following the #16326 epic, this task aims to develop the [design implementation of Wazuh integration with Amazon Security Lake as a subscriber](https://github.com/wazuh/wazuh/issues/16352#issuecomment-1462012296). 
Currently, Wazuh has the AWS module which fetches logs from S3 buckets and services like CloudWatch Logs from which we should develop a compatible new feature as the one proposed, following the guidelines outlined [here](https://github.com/wazuh/wazuh/issues/16352#issuecomment-1462111455).

## Tasks
- [x] Follow development best practices and adhere to our coding standards (PEP8, docstrings, etc).
- [x] Manual Test in a manager.
- [x] Manual Test in an agent.

**Comment by fdalmaup** [comment]
# Issue Update

Since this development will we carried out as part of the execution of the `aws_s3.py` script with new options including the name of the SQS queue from which the notifications will be pull, the possibility of purging the queue and more to be determined, the C files `src/wazuh_modules/wm_aws.c` and `src/wazuh_modules/wm_aws.h` part of `modulesd` execution should be also reviewed and modified accordingly.

**Comment by mateojames** [comment]
## Update

A new section for the configuration of the Security Lake in the `ossec.conf` was proposed:
```
<wodle name="aws-s3">
    ...
    <security_lake>
        <sqs_queue_name>sqs-security-lake-main-queue</sqs_queue_name>
        <iam_role_arn>arn:aws:iam::example</iam_role_arn>
        <iam_role_duration>1300</iam_role_duration> 
        <aws_profile>user_profile</aws_profile>
        <delete_from_queue>yes/no</delete_from_queue> 
        <notification_number></notification_number>
    </security_lake>
</wodle>
```
The section `<security_lake>` , found inside the `<wodle name="aws-s3">` section, will contain the following new fields:

- `<sqs_queue_name>` : Specifies the name of the queue
- `<delete_from_queue>` : Specifies if notifications should be deleted after being read (default value: **yes**)
- `<notification number>` : Specifies the amount of notifications to be read at a time

A previously considered `<purge_queue>` was decided not to be included because for the moment it is not considered to add value to the user, besides adding unnecessary complexity.

We have also advanced with the development of a new class called `AWSSQSQueue`, which will be in charge of containing the functionalities related to the SQS queue. This class has been integrated into the `aws_s3.py` module. In the previous script done for the POC, some hardcoded values were used for the demonstration. Now we make use of the information provided by the user.

**Comment by fdalmaup** [comment]
# Issue Update

The function sync_events() now runs once. Internally, it will follow the same sequence done in the POC:
1. Retrieve n notifications from an SQS queue
2. Extract the corresponding Parquet locations from the notifications
3. Retrieve said Parquets from the locations obtained
4. Parse the OCSF events in them
5. Send those events to Analysisd.
6. Delete the read notifications from the queue
This sequence will loop until no more messages are found in the SQS queue, were the function will come to an end.

To achieve steps 3 to 5, a new class called `AWSSLSubscriberBucket` has been added. This class, as `AWSSQSQueue`, inherits from `WazuhIntegration` in order to have the necessary methods and attributes to call the AWS API through `boto3`. The  `AWSSLSubscriberBucket` implements methods in order to obtain the parquet files stored in the S3 buckets made by Amazon Security Lake and process them to send the events inside of them. Thus, the output of the execution of the module is currently as follows:
```
/var/ossec/wodles/aws/aws-s3 -q <QUEUE_NAME> -qn 1 -p dev --debug 2
DEBUG: +++ Debug mode on - Level: 2
DEBUG: Generating default configuration for retries: mode standard - max_attempts 10
DEBUG: The SQS queue is: <QUEUE_URL>
DEBUG: Generating default configuration for retries: mode standard - max_attempts 10
DEBUG: Retrieving messages from: <QUEUE_NAME>
DEBUG: Processing file <PARQUET_FILE_ROUTE> in <AMAZON_SECURITY_LAKE_BUCKET>
DEBUG: Found 642 events in file <PARQUET_FILE_ROUTE>
DEBUG: 642 events sent to AnalysisD
```
This execution made use of the `-qn` / `--queue_notifications` option which determines the number of notifications to be fetched per API request. This option is yet to be discussed with the team as we are facing 3 main alternatives:

- Disable the option --> If the option is considered to add unnecessary complexity and add poor value for the user (The question is for example, why would they choose 1 instead of 10)
- Throw and handle an Exception if the value is greater than 10 --> Now if the value passed is greater than 10, an unhandled error will occur, stating: `ERROR: Error receiving message from SQS: An error occurred (InvalidParameterValue) when calling the ReceiveMessage operation: Value 13 for parameter MaxNumberOfMessages is invalid. Reason: Must be between 1 and 10, if provided.`. This is because, if the value is greater than 10, then "Long polling" is necessary for the implementation
- Long Polling implementation --> This would allow a user to choose greater values. This adds certain complexity, and by the testing done, using values such as 10 is really fast, so it may not be needed considering the size of the SQS Queue. However, it may be good to add this functionality as it extends the users' control over the queue handle.

**Comment by davidjiglesias** [comment]
After reviewing with the team (@fdalmaup, @mateojames and @Selutario) we have determined the following:

> Disable the option --> If the option is considered to add unnecessary complexity and add poor value for the user (The question is for example, why would they choose 1 instead of 10)

This option won't be configurable, at least in this first iteration.

> Throw and handle an Exception if the value is greater than 10 --> Now if the value passed is greater than 10, an unhandled error will occur, stating: ERROR: Error receiving message from SQS: An error occurred (InvalidParameterValue) when calling the ReceiveMessage operation: Value 13 for parameter MaxNumberOfMessages is invalid. Reason: Must be between 1 and 10, if provided.. This is because, if the value is greater than 10, then "Long polling" is necessary for the implementation

See above

> Long Polling implementation --> This would allow a user to choose greater values. This adds certain complexity, and by the testing done, using values such as 10 is really fast, so it may not be needed considering the size of the SQS Queue. However, it may be good to add this functionality as it extends the users' control over the queue handle.

We are going to use Long Polling with the maximum 20 seconds timer.

**Comment by mateojames** [comment]
<h1> Issue Update </h1>
After the discussion:

- The option `-qn` was erased, so it is not configurable anymore. 
- Long Polling was successfully set, with the fields `MaxNumberOfMessages=10` and `WaitTimeSeconds=20`, meaning the `receive_message` request queries all of the servers for messages. The SQS sends a response after it collects at least one available message, up to the maximum number of messages specified (10). Amazon SQS will send an empty response _only if the polling wait time (20 seconds) expires._
- The SQS was configured to accept Long Polling:

![image](https://user-images.githubusercontent.com/64434083/226725982-c5a16553-0381-437c-8637-32446eb222f3.png)

The queue has set by default a value of 0 seconds as `receive message wait time`. To enable Long Polling, this option was set to 20 from the console. However, preventively we have created a function that automatically configures the queue for long polling, this way the user will not have to manually set it by console. This function is executed only once after the script starts.
- The option `-qd` was created. It declares processed notifications from SQS queue shall not be removed once read. This comes as a replacement of the previous behavior, where you had to specify with a flag if you wanted them to be removed. This refactor means that by default, with no flag, the script will erase the messages from the queue after read.
- The implementation was integrated to _wazuh-modulesd_

> 2023/03/21 13:23:39 wazuh-modulesd:aws-s3: INFO: Module AWS started
> 2023/03/21 13:23:39 wazuh-modulesd:aws-s3: INFO: Starting fetching of logs.
> 2023/03/21 13:23:39 wazuh-modulesd:aws-s3: INFO: Executing Security Lake Subscriber fetch: (SQS: RedactedQueue, Profile: Redacted)

## Next steps:
- `Clean code`: Make sure we are following best practices on everything developed
- `Verification`: The functionality of the `ossec.conf` must be fully tested
- `Edge cases`: We must evaluate to an extent edge scenarios to see the behavior of the whole module in those cases. For example, what happens if the queue does not empty in the five minutes it takes for the module to re-run. If the program halts, and re-runs as it should, then we must contemplate what happens if it stops just before deleting the notifications from the queue for example, as it could lead to duplicated alerts.

**Comment by mateojames** [comment]
<h1>Issue Update</h1>

- `Clean code` 🟢 : We polished the code following development best practices and adhering to our coding standards (PEP8, docstrings, etc). All unnecessary code was removed.
- `Verification` 🟡 : The functionality of the `ossec.conf` was fully tested and some remaining discussions are needed
- `Edge cases` 🟢 : The edge cases were tested and corrected accordingly. We contemplated the escenario where the program stops just before deleting the notifications from the queue, which could lead to duplicated alerts. 

-----------------------------

<h2>Edge cases 🟢 </h2>
This last was solved by processing messages individually, instead of as a bulk.

### Before:

>  Retrieve messages from SQS (approximately 10)
>  Send the events of every message retrieved to AnalysisD
>  Delete every message retrieved from the SQS

### Now:

>  Retrieve messages from SQS (approximately 10)
>  Send the events of one message retrieved to AnalysisD
>  Delete the message from the SQS
>  Send one message retrieved to AnalysisD
>  Delete one message sent to AnalysisD from the SQS
> ...

This way:
- **_Worst case scenario:_**  The program comes to a halt after sending events to AnalysisD and before deleting a message
- **_Impact:_** The message will eventually be reprocessed, and its events will sent again to AnalysisD, generating a reduced amount of duplicated events

**Comment by mateojames** [comment]
<h1>Issue Update</h1>


<h2> Security Lake Section (ossec.conf) </h2>

The new section `<security_lake>` is defined inside the `<wodle name="aws-s3">` section of the `ossec.conf`.

```
wodle name="aws-s3">
    ...
    <security_lake>
        <sqs_queue_name>sqs-security-lake-main-queue</sqs_queue_name>
        <dont_remove_from_queue>yes/no</dont_remove_from_queue> 
        <iam_role_arn>arn:aws:iam::example</iam_role_arn>
        <iam_role_duration>1300</iam_role_duration> 
        <aws_profile>user_profile</aws_profile>
    </security_lake>
</wodle>
```

<h2>Parameters</h2>
 The following fields inside the section allow us to configure the queue and authenticate:

<h3>Queue configuration</h3>

- `<sqs_queue_name>`(Required) : Specifies the name of the queue
- `<dont_remove_from_queue>`(Optional) : Specifies if notifications should be deleted after being read (default value: no)

<h3>Authentication</h3>

There are two ways to set the authentication for the lake:

<h4>Using an IAM role:</h4>

- `<iam_role_arn>`: ARN for the corresponding IAM role to assume to access the S3 bucket
- `<iam_role_duration>`(Optional): The desired session duration in seconds.

<h4>Using a profile</h4>

- `<aws_profile>`: The name of credential profile to use

-----------------------------

<h2>Configure IAM Policies</h2>

If a user chooses to authenticate using IAM, the following modifications should be performed to the IAM policies to make the Wazuh integration work:

- Configure role: Modify the Security Lake subscriber role in order to associate an existing user with a role.
- Modify assumed role so it doesn't reference an External ID

Here is a step-by-step procedure to do so:
1. In the AWS console, navigate to the Amazon IAM service.
2. In the Amazon IAM service, navigate to the Roles page.
3. On the Roles page, select the Role name of the subscription role notification that was created as part of the Security Lake subscriber provisioning process.
4. On the Summary page, navigate to the Trust relationships tab.
5. Modify the Trusted entity policy:
    We should define the policy so that it lets the desired user assume roles in only one account. In addition, the policy should specify that the user can switch to a role only if the role name is.
    1. Remove any reference to the External ID that was created during the Security Lake subscriber provisioning process.
    2. Edit the configuration, changing the values of **account** with the account-id and **resource** with the Security Lake, so it looks like this:

  ```
   {
      "Version": "2012-10-17",
      "Statement": {
          "Effect": "Allow",
          "Action": "sts:AssumeRole",
          "Resource": "arn:aws:iam::<account-id>:role/<resource>"
       }
  }
  ```

Here is the official AWS documentation to do so: https://docs.aws.amazon.com/IAM/latest/UserGuide/id_roles_use_permissions-to-switch.html#roles-usingrole-createpolicy

--------------------

<h2>Execution Test 🟢 </h2>

The module was executed by modifying the `ossec.conf` configuration, and restarting the service. 
The objective was to test both methods of authentication. Here are the results:

<h3>Execution using IAM Role 🟢 </h3>

<details><summary>ossec.conf</summary>

```
   <wodle name="aws-s3">
       <disabled>no</disabled>
       <interval>1h</interval>
       <run_on_start>yes</run_on_start>
       <security_lake>
           <sqs_queue_name>AmazonSecurityLake-REDACTED-Queue</sqs_queue_name>
           <iam_role_arn>arn:aws:iam::REDACTED:role/REDACTED</iam_role_arn>
           <iam_role_duration>1300</iam_role_duration>
       </security_lake>
   </wodle>
```

</details>
 
<details><summary>ossec.log output</summary>

```
2023/03/23 19:12:28 wazuh-modulesd:aws-s3[43054] wmodules-aws.c:486 at wm_aws_read(): DEBUG: Found a security lake tag
2023/03/23 19:12:28 wazuh-modulesd:aws-s3[43054] wmodules-aws.c:497 at wm_aws_read(): DEBUG: Creating first security lake structure
2023/03/23 19:12:28 wazuh-modulesd:aws-s3[43054] wmodules-aws.c:506 at wm_aws_read(): DEBUG: Loop thru child nodes
2023/03/23 19:12:28 wazuh-modulesd:aws-s3[43054] wmodules-aws.c:509 at wm_aws_read(): DEBUG: Parse child node: sqs_queue_name
2023/03/23 19:12:28 wazuh-modulesd:aws-s3[43054] wmodules-aws.c:509 at wm_aws_read(): DEBUG: Parse child node: iam_role_arn
2023/03/23 19:12:28 wazuh-modulesd:aws-s3[43054] wmodules-aws.c:509 at wm_aws_read(): DEBUG: Parse child node: iam_role_duration
2023/03/23 19:12:28 wazuh-modulesd[43054] main.c:95 at main(): DEBUG: Created new thread for the 'aws-s3' module.
2023/03/23 19:12:28 wazuh-modulesd:aws-s3[43054] wm_aws.c:62 at wm_aws_main(): INFO: Module AWS started
2023/03/23 19:12:28 wazuh-modulesd:aws-s3[43054] wm_aws.c:84 at wm_aws_main(): INFO: Starting fetching of logs.
2023/03/23 19:12:28 wazuh-modulesd:aws-s3[43054] wm_aws.c:194 at wm_aws_main(): INFO: Executing Security Lake Subscriber fetch: (SQS: AmazonSecurityLake-REDACTED-Queue)
2023/03/23 19:12:28 wazuh-modulesd:aws-s3[43054] wm_aws.c:722 at wm_aws_run_security_lake_subscriber(): DEBUG: Create argument list
2023/03/23 19:12:28 wazuh-modulesd:aws-s3[43054] wm_aws.c:789 at wm_aws_run_security_lake_subscriber(): DEBUG: Launching Security Lake Subscriber Command: wodles/aws/aws-s3 --queue AmazonSecurityLake-REDACTED-Queue --iam_role_arn arn:aws:iam::REDACTED:role/REDACTED --iam_role_duration 1300 --debug 2
2023/03/23 19:12:57 wazuh-modulesd:aws-s3[43054] wm_aws.c:830 at wm_aws_run_security_lake_subscriber(): DEBUG: Security Lake SQS Queue: AmazonSecurityLake-REDACTED-Queue  -  OUTPUT: DEBUG: +++ Debug mode on - Level: 2
DEBUG: Processing file aws/CLOUD_TRAIL/region=REDACTED/accountId=567970947422/eventHour=2023032318/REDACTED.gz.parquet in aws-security-data-lake-REDACTED
DEBUG: Found 38 events in file aws/CLOUD_TRAIL/region=REDACTED/accountId=567970947422/eventHour=2023032318/REDACTED.gz.parquet
DEBUG: Processing file aws/VPC_FLOW/region=REDACTED/accountId=567970947422/eventHour=2023032319/REDACTED.gz.parquet in aws-security-data-lake-REDACTED
DEBUG: Found 225 events in file aws/VPC_FLOW/region=REDACTED/accountId=567970947422/eventHour=2023032319/REDACTED.gz.parquet
DEBUG: Processing file aws/CLOUD_TRAIL/region=REDACTED/accountId=567970947422/eventHour=2023032319/REDACTED.gz.parquet in aws-security-data-lake-REDACTED
DEBUG: Found 328 events in file aws/CLOUD_TRAIL/region=REDACTED/accountId=567970947422/eventHour=2023032319/REDACTED.gz.parquet
DEBUG: Processing file aws/VPC_FLOW/region=REDACTED/accountId=567970947422/eventHour=2023032318/REDACTED.gz.parquet in aws-security-data-lake-REDACTED
DEBUG: Found 271 events in file aws/VPC_FLOW/region=REDACTED/accountId=567970947422/eventHour=2023032318/REDACTED.gz.parquet
2023/03/23 19:12:58 wazuh-modulesd:aws-s3[43054] wm_aws.c:199 at wm_aws_main(): INFO: Fetching logs finished.
2023/03/23 19:12:58 wazuh-modulesd:aws-s3[43054] wm_aws.c:80 at wm_aws_main(): DEBUG: Sleeping until: 2023/03/23 20:12:28
```

</details>

<h3>Execution using profile 🟢 </h3>

<details><summary>ossec.conf</summary>

```
   <wodle name="aws-s3">
       <disabled>no</disabled>
       <interval>1h</interval>
       <run_on_start>yes</run_on_start>
       <security_lake>
           <sqs_queue_name>AmazonSecurityLake-REDACTED-Queue</sqs_queue_name>
           <aws_profile>dev</aws_profile>
       </security_lake>
   </wodle>
```

</details>

<details><summary>ossec.log output</summary>

```
2023/03/23 19:25:45 wazuh-modulesd:aws-s3[61617] wmodules-aws.c:486 at wm_aws_read(): DEBUG: Found a security lake tag
2023/03/23 19:25:45 wazuh-modulesd:aws-s3[61617] wmodules-aws.c:497 at wm_aws_read(): DEBUG: Creating first security lake structure
2023/03/23 19:25:45 wazuh-modulesd:aws-s3[61617] wmodules-aws.c:506 at wm_aws_read(): DEBUG: Loop thru child nodes
2023/03/23 19:25:45 wazuh-modulesd:aws-s3[61617] wmodules-aws.c:509 at wm_aws_read(): DEBUG: Parse child node: sqs_queue_name
2023/03/23 19:25:45 wazuh-modulesd:aws-s3[61617] wmodules-aws.c:509 at wm_aws_read(): DEBUG: Parse child node: aws_profile
2023/03/23 19:25:45 wazuh-modulesd[61617] main.c:95 at main(): DEBUG: Created new thread for the 'aws-s3' module.
2023/03/23 19:25:45 wazuh-modulesd:aws-s3[61617] wm_aws.c:62 at wm_aws_main(): INFO: Module AWS started
2023/03/23 19:25:45 wazuh-modulesd:aws-s3[61617] wm_aws.c:84 at wm_aws_main(): INFO: Starting fetching of logs.
2023/03/23 19:25:45 wazuh-modulesd:aws-s3[61617] wm_aws.c:194 at wm_aws_main(): INFO: Executing Security Lake Subscriber fetch: (SQS: AmazonSecurityLake-REDACTED-Queue, Profile: dev)
2023/03/23 19:25:45 wazuh-modulesd:aws-s3[61617] wm_aws.c:722 at wm_aws_run_security_lake_subscriber(): DEBUG: Create argument list
2023/03/23 19:25:45 wazuh-modulesd:aws-s3[61617] wm_aws.c:789 at wm_aws_run_security_lake_subscriber(): DEBUG: Launching Security Lake Subscriber Command: wodles/aws/aws-s3 --queue AmazonSecurityLake-REDACTED-Queue --aws_profile dev --debug 2
2023/03/23 19:25:49 wazuh-modulesd:syscollector[61617] wm_syscollector.c:105 at wm_sys_log(): DEBUG: Sync sent: {"component":"syscollector_processes","data":{"attributes":{"argvs":"wodles/aws/aws-s3 --queue AmazonSecurityLake-REDACTED-Queue --aws_profile dev --debug 2","checksum":"70b6b14f4677157932b58db803738fd300e3a723","cmd":"/bin/sh","egroup":"root","euser":"root","fgroup":"root","name":"aws-s3","nice":10,"nlwp":1,"pgrp":61637,"pid":"61637","ppid":61619,"priority":30,"processor":3,"resident":126,"rgroup":"root","ruser":"root","scan_time":"2023/03/23 19:25:49","session":61637,"sgroup":"root","share":109,"size":515,"start_time":1679599545,"state":"S","stime":0,"suser":"root","tgid":61637,"tty":0,"utime":0,"vm_size":2060},"index":"61637","timestamp":""},"type":"state"}
2023/03/23 19:25:49 wazuh-db[61223] wdb_parser.c:263 at wdb_parse(): DEBUG: Agent 000 query: syscollector_processes save2 {"attributes":{"argvs":"wodles/aws/aws-s3 --queue AmazonSecurityLake-REDACTED-Queue --aws_profile dev --debug 2","checksum":"70b6b14f4677157932b58db803738fd300e3a723","cmd":"/bin/sh","egroup":"root","euser":"root","fgroup":"root","name":"aws-s3","nice":10,"nlwp":1,"pgrp":61637,"pid":"61637","ppid":61619,"priority":30,"processor":3,"resident":126,"rgroup":"root","ruser":"root","scan_time":"2023/03/23 19:25:49","session":61637,"sgroup":"root","share":109,"size":515,"start_time":1679599545,"state":"S","stime":0,"suser":"root","tgid":61637,"tty":0,"utime":0,"vm_size":2060},"index":"61637","timestamp":""}
2023/03/23 19:25:49 wazuh-modulesd:syscollector[61617] wm_syscollector.c:105 at wm_sys_log(): DEBUG: Sync sent: {"component":"syscollector_processes","data":{"attributes":{"argvs":"/var/ossec/wodles/aws/aws-s3.py --queue AmazonSecurityLake-REDACTED-Queue --aws_profile dev --debug 2","checksum":"8e9b39589a6ce5e23931f8bf530ba284dfb8ed7a","cmd":"/var/ossec/framework/python/bin/python3","egroup":"root","euser":"root","fgroup":"root","name":"python3","nice":10,"nlwp":1,"pgrp":61637,"pid":"61657","ppid":61637,"priority":30,"processor":3,"resident":2263,"rgroup":"root","ruser":"root","scan_time":"2023/03/23 19:25:49","session":61637,"sgroup":"root","share":1531,"size":4450,"start_time":1679599545,"state":"R","stime":0,"suser":"root","tgid":61657,"tty":0,"utime":0,"vm_size":17800},"index":"61657","timestamp":""},"type":"state"}
2023/03/23 19:25:49 wazuh-db[61223] wdb_parser.c:263 at wdb_parse(): DEBUG: Agent 000 query: syscollector_processes save2 {"attributes":{"argvs":"/var/ossec/wodles/aws/aws-s3.py --queue AmazonSecurityLake-REDACTED-Queue --aws_profile dev --debug 2","checksum":"8e9b39589a6ce5e23931f8bf530ba284dfb8ed7a","cmd":"/var/ossec/framework/python/bin/python3","egroup":"root","euser":"root","fgroup":"root","name":"python3","nice":10,"nlwp":1,"pgrp":61637,"pid":"61657","ppid":61637,"priority":30,"processor":3,"resident":2263,"rgroup":"root","ruser":"root","scan_time":"2023/03/23 19:25:49","session":61637,"sgroup":"root","share":1531,"size":4450,"start_time":1679599545,"state":"R","stime":0,"suser":"root","tgid":61657,"tty":0,"utime":0,"vm_size":17800},"index":"61657","timestamp":""}
2023/03/23 19:26:14 wazuh-modulesd:aws-s3[61617] wm_aws.c:830 at wm_aws_run_security_lake_subscriber(): DEBUG: Security Lake SQS Queue: AmazonSecurityLake-REDACTED-Queue  -  OUTPUT: DEBUG: +++ Debug mode on - Level: 2
DEBUG: Processing file aws/VPC_FLOW/region=REDACTED/accountId=REDACTED/eventHour=2023032318/REDACTED.gz.parquet in aws-security-data-lake-REDACTED
DEBUG: Found 60 events in file aws/VPC_FLOW/region=REDACTED/accountId=REDACTED/eventHour=2023032318/REDACTED.gz.parquet
DEBUG: Processing file aws/VPC_FLOW/region=REDACTED/accountId=REDACTED/eventHour=2023032319/REDACTED.gz.parquet in aws-security-data-lake-REDACTED
DEBUG: Found 516 events in file aws/VPC_FLOW/region=REDACTED/accountId=REDACTED/eventHour=2023032319/REDACTED.gz.parquet
DEBUG: Processing file aws/CLOUD_TRAIL/region=REDACTED/accountId=REDACTED/eventHour=2023032319/REDACTED.gz.parquet in aws-security-data-lake-REDACTED
DEBUG: Found 307 events in file aws/CLOUD_TRAIL/region=REDACTED/accountId=REDACTED/eventHour=2023032319/REDACTED.gz.parquet
DEBUG: Processing file aws/VPC_FLOW/region=REDACTED/accountId=REDACTED/eventHour=2023032319/REDACTED.gz.parquet in aws-security-data-lake-REDACTED
DEBUG: Found 503 events in file aws/VPC_FLOW/region=REDACTED/accountId=REDACTED/eventHour=2023032319/REDACTED.gz.parquet
DEBUG: Processing file aws/CLOUD_TRAIL/region=REDACTED/accountId=REDACTED/eventHour=2023032319/REDACTED.gz.parquet in aws-security-data-lake-REDACTED
DEBUG: Found 181 events in file aws/CLOUD_TRAIL/region=REDACTED/accountId=REDACTED/eventHour=2023032319/REDACTED.gz.parquet
DEBUG: Processing file aws/CLOUD_TRAIL/region=REDACTED/accountId=REDACTED/eventHour=2023032319/REDACTED.gz.parquet in aws-security-data-lake-REDACTED
DEBUG: Found 131 events in file aws/CLOUD_TRAIL/region=REDACTED/accountId=REDACTED/eventHour=2023032319/REDACTED.gz.parquet
DEBUG: Processing file aws/VPC_FLOW/region=REDACTED/accountId=REDACTED/eventHour=2023032319/REDACTED.gz.parquet in aws-security-data-lake-REDACTED
DEBUG: Found 536 events in file aws/VPC_FLOW/region=REDACTED/accountId=REDACTED/eventHour=2023032319/REDACTED.gz.parquet
2023/03/23 19:26:15 wazuh-modulesd:aws-s3[61617] wm_aws.c:199 at wm_aws_main(): INFO: Fetching logs finished.
2023/03/23 19:26:15 wazuh-modulesd:aws-s3[61617] wm_aws.c:80 at wm_aws_main(): DEBUG: Sleeping until: 2023/03/23 20:25:45
```

</details>

----------------

<h2>Final comment</h2>
Based on the successful results of the tests conducted, we determine this issue is now ready for closure.

**Comment by mateojames** [comment]
<h1>Issue Update</h1>


<h2> Security Lake Section (ossec.conf) </h2>

The new section `<security_lake>` is defined inside the `<wodle name="aws-s3">` section of the `ossec.conf`.

```
wodle name="aws-s3">
    ...
    <security_lake>
        <sqs_queue_name>sqs-security-lake-main-queue</sqs_queue_name>
        <dont_remove_from_queue>yes/no</dont_remove_from_queue> 
        <iam_role_arn>arn:aws:iam::example</iam_role_arn>
        <iam_role_duration>1300</iam_role_duration> 
        <aws_profile>user_profile</aws_profile>
    </security_lake>
</wodle>
```

<h2>Parameters</h2>
 The following fields inside the section allow us to configure the queue and authenticate:

<h3>Queue configuration</h3>

- `<sqs_queue_name>`(Required) : Specifies the name of the queue
- `<dont_remove_from_queue>`(Optional) : Specifies if notifications should **not** be deleted after being read (default value: no)

<h3>Authentication</h3>

There are two ways to set the authentication for the lake:

<h4>Using an IAM role:</h4>

- `<iam_role_arn>`: ARN for the corresponding IAM role to assume to access both the S3 bucket and the SQS queue
- `<iam_role_duration>`(Optional): The desired session duration in seconds.

<h4>Using a profile</h4>

- `<aws_profile>`: The name of credential profile to use

-----------------------------

<h2>Configure IAM Policies</h2>

If a user chooses to authenticate using IAM, the following modifications should be performed to the IAM policies to make the Wazuh integration work:

- Configure role: Modify the Security Lake subscriber role in order to associate an existing user with a role.
- Modify assumed role so it doesn't reference an External ID

Here is a step-by-step procedure to do so:
1. In the AWS console, navigate to the Amazon IAM service.
2. In the Amazon IAM service, navigate to the Roles page.
3. On the Roles page, select the Role name of the subscription role notification that was created as part of the Security Lake subscriber provisioning process.
4. On the Summary page, navigate to the Trust relationships tab.
5. Modify the Trusted entity policy:
    We should define the policy so that it lets the desired user assume roles in only one account. In addition, the policy should specify that the user can switch to a role only if the role name is.
    1. Remove any reference to the External ID that was created during the Security Lake subscriber provisioning process.
    2. Edit the configuration, changing the values of **account** with the account-id and **resource** with the Security Lake, so it looks like this:

  ```
   {
      "Version": "2012-10-17",
      "Statement": {
          "Effect": "Allow",
          "Action": "sts:AssumeRole",
          "Resource": "arn:aws:iam::<account-id>:role/<resource>"
       }
  }
  ```

Here is the official AWS documentation to do so: https://docs.aws.amazon.com/IAM/latest/UserGuide/id_roles_use_permissions-to-switch.html#roles-usingrole-createpolicy

--------------------

<h2>Execution Test 🟢 </h2>

The module was executed by modifying the `ossec.conf` configuration, and restarting the service. 
The objective was to test both methods of authentication. Here are the results:

<h3>Execution using IAM Role 🟢 </h3>

<details><summary>ossec.conf</summary>

```
   <wodle name="aws-s3">
       <disabled>no</disabled>
       <interval>1h</interval>
       <run_on_start>yes</run_on_start>
       <security_lake>
           <sqs_queue_name>AmazonSecurityLake-REDACTED-Queue</sqs_queue_name>
           <iam_role_arn>arn:aws:iam::REDACTED:role/REDACTED</iam_role_arn>
           <iam_role_duration>1300</iam_role_duration>
       </security_lake>
   </wodle>
```

</details>
 
<details><summary>ossec.log output</summary>

```
2023/03/23 19:12:28 wazuh-modulesd:aws-s3[43054] wmodules-aws.c:486 at wm_aws_read(): DEBUG: Found a security lake tag
2023/03/23 19:12:28 wazuh-modulesd:aws-s3[43054] wmodules-aws.c:497 at wm_aws_read(): DEBUG: Creating first security lake structure
2023/03/23 19:12:28 wazuh-modulesd:aws-s3[43054] wmodules-aws.c:506 at wm_aws_read(): DEBUG: Loop thru child nodes
2023/03/23 19:12:28 wazuh-modulesd:aws-s3[43054] wmodules-aws.c:509 at wm_aws_read(): DEBUG: Parse child node: sqs_queue_name
2023/03/23 19:12:28 wazuh-modulesd:aws-s3[43054] wmodules-aws.c:509 at wm_aws_read(): DEBUG: Parse child node: iam_role_arn
2023/03/23 19:12:28 wazuh-modulesd:aws-s3[43054] wmodules-aws.c:509 at wm_aws_read(): DEBUG: Parse child node: iam_role_duration
2023/03/23 19:12:28 wazuh-modulesd[43054] main.c:95 at main(): DEBUG: Created new thread for the 'aws-s3' module.
2023/03/23 19:12:28 wazuh-modulesd:aws-s3[43054] wm_aws.c:62 at wm_aws_main(): INFO: Module AWS started
2023/03/23 19:12:28 wazuh-modulesd:aws-s3[43054] wm_aws.c:84 at wm_aws_main(): INFO: Starting fetching of logs.
2023/03/23 19:12:28 wazuh-modulesd:aws-s3[43054] wm_aws.c:194 at wm_aws_main(): INFO: Executing Security Lake Subscriber fetch: (SQS: AmazonSecurityLake-REDACTED-Queue)
2023/03/23 19:12:28 wazuh-modulesd:aws-s3[43054] wm_aws.c:722 at wm_aws_run_security_lake_subscriber(): DEBUG: Create argument list
2023/03/23 19:12:28 wazuh-modulesd:aws-s3[43054] wm_aws.c:789 at wm_aws_run_security_lake_subscriber(): DEBUG: Launching Security Lake Subscriber Command: wodles/aws/aws-s3 --queue AmazonSecurityLake-REDACTED-Queue --iam_role_arn arn:aws:iam::REDACTED:role/REDACTED --iam_role_duration 1300 --debug 2
2023/03/23 19:12:57 wazuh-modulesd:aws-s3[43054] wm_aws.c:830 at wm_aws_run_security_lake_subscriber(): DEBUG: Security Lake SQS Queue: AmazonSecurityLake-REDACTED-Queue  -  OUTPUT: DEBUG: +++ Debug mode on - Level: 2
DEBUG: Processing file aws/CLOUD_TRAIL/region=REDACTED/accountId=REDACTED/eventHour=2023032318/REDACTED.gz.parquet in aws-security-data-lake-REDACTED
DEBUG: Found 38 events in file aws/CLOUD_TRAIL/region=REDACTED/accountId=REDACTED/eventHour=2023032318/REDACTED.gz.parquet
DEBUG: Processing file aws/VPC_FLOW/region=REDACTED/accountId=REDACTED/eventHour=2023032319/REDACTED.gz.parquet in aws-security-data-lake-REDACTED
DEBUG: Found 225 events in file aws/VPC_FLOW/region=REDACTED/accountId=REDACTED/eventHour=2023032319/REDACTED.gz.parquet
DEBUG: Processing file aws/CLOUD_TRAIL/region=REDACTED/accountId=REDACTED/eventHour=2023032319/REDACTED.gz.parquet in aws-security-data-lake-REDACTED
DEBUG: Found 328 events in file aws/CLOUD_TRAIL/region=REDACTED/accountId=REDACTED/eventHour=2023032319/REDACTED.gz.parquet
DEBUG: Processing file aws/VPC_FLOW/region=REDACTED/accountId=REDACTED/eventHour=2023032318/REDACTED.gz.parquet in aws-security-data-lake-REDACTED
DEBUG: Found 271 events in file aws/VPC_FLOW/region=REDACTED/accountId=REDACTED/eventHour=2023032318/REDACTED.gz.parquet
2023/03/23 19:12:58 wazuh-modulesd:aws-s3[43054] wm_aws.c:199 at wm_aws_main(): INFO: Fetching logs finished.
2023/03/23 19:12:58 wazuh-modulesd:aws-s3[43054] wm_aws.c:80 at wm_aws_main(): DEBUG: Sleeping until: 2023/03/23 20:12:28
```

</details>

<h3>Execution using profile 🟢 </h3>

<details><summary>ossec.conf</summary>

```
   <wodle name="aws-s3">
       <disabled>no</disabled>
       <interval>1h</interval>
       <run_on_start>yes</run_on_start>
       <security_lake>
           <sqs_queue_name>AmazonSecurityLake-REDACTED-Queue</sqs_queue_name>
           <aws_profile>dev</aws_profile>
       </security_lake>
   </wodle>
```

</details>

<details><summary>ossec.log output</summary>

```
2023/03/23 19:25:45 wazuh-modulesd:aws-s3[61617] wmodules-aws.c:486 at wm_aws_read(): DEBUG: Found a security lake tag
2023/03/23 19:25:45 wazuh-modulesd:aws-s3[61617] wmodules-aws.c:497 at wm_aws_read(): DEBUG: Creating first security lake structure
2023/03/23 19:25:45 wazuh-modulesd:aws-s3[61617] wmodules-aws.c:506 at wm_aws_read(): DEBUG: Loop thru child nodes
2023/03/23 19:25:45 wazuh-modulesd:aws-s3[61617] wmodules-aws.c:509 at wm_aws_read(): DEBUG: Parse child node: sqs_queue_name
2023/03/23 19:25:45 wazuh-modulesd:aws-s3[61617] wmodules-aws.c:509 at wm_aws_read(): DEBUG: Parse child node: aws_profile
2023/03/23 19:25:45 wazuh-modulesd[61617] main.c:95 at main(): DEBUG: Created new thread for the 'aws-s3' module.
2023/03/23 19:25:45 wazuh-modulesd:aws-s3[61617] wm_aws.c:62 at wm_aws_main(): INFO: Module AWS started
2023/03/23 19:25:45 wazuh-modulesd:aws-s3[61617] wm_aws.c:84 at wm_aws_main(): INFO: Starting fetching of logs.
2023/03/23 19:25:45 wazuh-modulesd:aws-s3[61617] wm_aws.c:194 at wm_aws_main(): INFO: Executing Security Lake Subscriber fetch: (SQS: AmazonSecurityLake-REDACTED-Queue, Profile: dev)
2023/03/23 19:25:45 wazuh-modulesd:aws-s3[61617] wm_aws.c:722 at wm_aws_run_security_lake_subscriber(): DEBUG: Create argument list
2023/03/23 19:25:45 wazuh-modulesd:aws-s3[61617] wm_aws.c:789 at wm_aws_run_security_lake_subscriber(): DEBUG: Launching Security Lake Subscriber Command: wodles/aws/aws-s3 --queue AmazonSecurityLake-REDACTED-Queue --aws_profile dev --debug 2
2023/03/23 19:26:14 wazuh-modulesd:aws-s3[61617] wm_aws.c:830 at wm_aws_run_security_lake_subscriber(): DEBUG: Security Lake SQS Queue: AmazonSecurityLake-REDACTED-Queue  -  OUTPUT: DEBUG: +++ Debug mode on - Level: 2
DEBUG: Processing file aws/VPC_FLOW/region=REDACTED/accountId=REDACTED/eventHour=2023032318/REDACTED.gz.parquet in aws-security-data-lake-REDACTED
DEBUG: Found 60 events in file aws/VPC_FLOW/region=REDACTED/accountId=REDACTED/eventHour=2023032318/REDACTED.gz.parquet
DEBUG: Processing file aws/VPC_FLOW/region=REDACTED/accountId=REDACTED/eventHour=2023032319/REDACTED.gz.parquet in aws-security-data-lake-REDACTED
DEBUG: Found 516 events in file aws/VPC_FLOW/region=REDACTED/accountId=REDACTED/eventHour=2023032319/REDACTED.gz.parquet
DEBUG: Processing file aws/CLOUD_TRAIL/region=REDACTED/accountId=REDACTED/eventHour=2023032319/REDACTED.gz.parquet in aws-security-data-lake-REDACTED
DEBUG: Found 307 events in file aws/CLOUD_TRAIL/region=REDACTED/accountId=REDACTED/eventHour=2023032319/REDACTED.gz.parquet
DEBUG: Processing file aws/VPC_FLOW/region=REDACTED/accountId=REDACTED/eventHour=2023032319/REDACTED.gz.parquet in aws-security-data-lake-REDACTED
DEBUG: Found 503 events in file aws/VPC_FLOW/region=REDACTED/accountId=REDACTED/eventHour=2023032319/REDACTED.gz.parquet
DEBUG: Processing file aws/CLOUD_TRAIL/region=REDACTED/accountId=REDACTED/eventHour=2023032319/REDACTED.gz.parquet in aws-security-data-lake-REDACTED
DEBUG: Found 181 events in file aws/CLOUD_TRAIL/region=REDACTED/accountId=REDACTED/eventHour=2023032319/REDACTED.gz.parquet
DEBUG: Processing file aws/CLOUD_TRAIL/region=REDACTED/accountId=REDACTED/eventHour=2023032319/REDACTED.gz.parquet in aws-security-data-lake-REDACTED
DEBUG: Found 131 events in file aws/CLOUD_TRAIL/region=REDACTED/accountId=REDACTED/eventHour=2023032319/REDACTED.gz.parquet
DEBUG: Processing file aws/VPC_FLOW/region=REDACTED/accountId=REDACTED/eventHour=2023032319/REDACTED.gz.parquet in aws-security-data-lake-REDACTED
DEBUG: Found 536 events in file aws/VPC_FLOW/region=REDACTED/accountId=REDACTED/eventHour=2023032319/REDACTED.gz.parquet
2023/03/23 19:26:15 wazuh-modulesd:aws-s3[61617] wm_aws.c:199 at wm_aws_main(): INFO: Fetching logs finished.
2023/03/23 19:26:15 wazuh-modulesd:aws-s3[61617] wm_aws.c:80 at wm_aws_main(): DEBUG: Sleeping until: 2023/03/23 20:25:45
```

</details>

----------------

<h2>Final comment</h2>

Based on the successful results of the tests conducted, we determine this issue is now ready for closure.

**Comment by mateojames** [comment]
<h1>Issue Update</h1>

After discussing with the team, the following changes were implemented:

- Removed the field `<don't_remove_from_queue>`. It was decided there was no real use case for this configuration, and that all notifications will be erased after being read and sent to AnalysisD.
- The field `<sqs_queue_name>` was changed to `<sqs_name>`
- The tag `<security_lake>` was changed to `<subscriber type="security_lake">`. This was done in case more uses for subscriptions types, like SQS, are implemented in the future.

With these changes, the ossec.conf configuration remains as follows:

```
<wodle name="aws-s3">
    ...
    <subscriber type="security_lake">
        <sqs_name>sqs-security-lake-main-queue</sqs_name>
        <iam_role_arn>arn:aws:iam::example</iam_role_arn>
        <iam_role_duration>1300</iam_role_duration> 
        <aws_profile>user_profile</aws_profile>
    </subscriber>
</wodle>
```

The implementation was decided to be included as part of 4.5, and the issues for Unit Tests, Integration Tests and Documentation regarding the development done on this issue were created.

**Comment by fdalmaup** [comment]
<h1>Issue Update</h1>

After discussing with the team, the following changes were implemented:

- Removed the field `<don't_remove_from_queue>`. It was decided there was no real use case for this configuration, and that all notifications will be erased after being read and sent to AnalysisD.
- The field `<sqs_queue_name>` was changed to `<sqs_name>`
- The tag `<security_lake>` was changed to `<subscriber type="security_lake">`. This was done in case more uses for subscription types, like the one developed for Amazon Security Lake, are implemented in the future.

With these changes, the ossec.conf configuration remains as follows:

```
<wodle name="aws-s3">
    ...
    <subscriber type="security_lake">
        <sqs_name>sqs-security-lake-main-queue</sqs_name>
        <iam_role_arn>arn:aws:iam::example</iam_role_arn>
        <iam_role_duration>1300</iam_role_duration> 
        <aws_profile>user_profile</aws_profile>
    </subscriber>
</wodle>
```

The implementation was decided to be included as part of 4.5, and the issues for Unit Tests, Integration Tests, and Documentation regarding the development done on this issue were created.

**Comment by fdalmaup** [comment]
# Issue Update

To maintain compatibility with the current authenticating options, the fields `sts_endpoint` and `service_endpoint` were added. The final configuration is:
```
<wodle name="aws-s3">
    ...
    <subscriber type="security_lake">
        <sqs_name>sqs-security-lake-main-queue</sqs_name>
        <iam_role_arn>arn:aws:iam::example</iam_role_arn>
        <iam_role_duration>1300</iam_role_duration> 
        <aws_profile>user_profile</aws_profile>
        <sts_endpoint>sts-endpoint-IAM</sts_endpoint>
        <service_endpoint>sqs.region.amazonaws.com</service_endpoint>
    </subscriber>
</wodle>
```

**Comment by fdalmaup** [comment]
# Issue Update

After meeting with the team, it was decided that the `<service_endpoint>` field should allow values for AWS S3 endpoint URLs to be used to download the data from the Lake's buckets.

Task:

- [ ] Review the use of the `service_endpoint` parameter to reduce the traffic cost when downloading S3 files.

**Comment by mateojames** [comment]
The `sts_endpoint` and `service_endpoint` were added to the bucketHandler in order to improve performance and reduce traffic cost. Some testing still needs to be done.

**Comment by mateojames** [comment]
🟢 Both endpoints were successfully added and tested.

**Comment by fdalmaup** [comment]
# Test using multiple subscribers with the same Queue

The purpose of this test was to verify what happens when multiple `subscriber` blocks are declared in the `ossec.conf`, like:
```
    <wodle name="aws-s3">
        <disabled>no</disabled>
        <interval>1h</interval>
        <run_on_start>yes</run_on_start>
        <subscriber type="security_lake">
            <sqs_name>ASL-Main-Queue</sqs_name>
            <iam_role_arn>arn:aws:iam::account-id:role/ASL-Role</iam_role_arn>
        </subscriber>
        <subscriber type="security_lake">
            <sqs_name>ASL-Main-Queue</sqs_name>
            <aws_profile>default</aws_profile>
        </subscriber>
    </wodle>
```

The result in `ossec.log` was:
<details>

    2023/04/05 09:13:15 wazuh-modulesd:aws-s3[3098] wm_aws.c:62 at wm_aws_main(): INFO: Module AWS started
    2023/04/05 09:13:15 wazuh-modulesd:aws-s3[3098] wm_aws.c:84 at wm_aws_main(): INFO: Starting fetching of logs.
    2023/04/05 09:13:15 wazuh-modulesd:aws-s3[3098] wm_aws.c:201 at wm_aws_main(): INFO: Executing Subscriber fetch: (Type and SQS: security_lake ASL-Main-Queue)
    2023/04/05 09:13:15 wazuh-modulesd:aws-s3[3098] wm_aws.c:729 at wm_aws_run_subscriber(): DEBUG: Create argument list
    2023/04/05 09:13:15 wazuh-modulesd:aws-s3[3098] wm_aws.c:795 at wm_aws_run_subscriber(): DEBUG: Launching Security Lake Subscriber Command: wodles/aws/aws-s3 --subscriber security_lake --queue ASL-Main-Queue --iam_role_arn arn:aws:iam::account-id:role/ASL-Role --debug 2
    DEBUG: The SQS queue is: https://queue.amazonaws.com/account-id/ASL-Main-Queue
    DEBUG: Found 708 events in file aws/VPC_FLOW/region=us-east-1/accountId=account-id/eventHour=2023040503/4cc3a7c5c69bbc96212271b0fe87ea1b.gz.parquet
    ...
    DEBUG: Processing file aws/CLOUD_TRAIL/region=us-east-1/accountId=account-id/eventHour=2023040512/c0c3a8ad0543b0792ce32cd8cec42ef4.gz.parquet in aws-security-data-lake-us-east-1-bucket-suffix
    DEBUG: Found 336 events in file aws/CLOUD_TRAIL/region=us-east-1/accountId=account-id/eventHour=2023040512/c0c3a8ad0543b0792ce32cd8cec42ef4.gz.parquet
    2023/04/05 09:19:35 wazuh-modulesd:aws-s3[3098] wm_aws.c:201 at wm_aws_main(): INFO: Executing Subscriber fetch: (Type and SQS: security_lake ASL-Main-Queue, Profile: default)
    2023/04/05 09:19:35 wazuh-modulesd:aws-s3[3098] wm_aws.c:729 at wm_aws_run_subscriber(): DEBUG: Create argument list
    2023/04/05 09:19:35 wazuh-modulesd:aws-s3[3098] wm_aws.c:795 at wm_aws_run_subscriber(): DEBUG: Launching Security Lake Subscriber Command: wodles/aws/aws-s3 --subscriber security_lake --queue ASL-Main-Queue --aws_profile default --debug 2
    2023/04/05 09:19:57 wazuh-modulesd:aws-s3[3098] wm_aws.c:836 at wm_aws_run_subscriber(): DEBUG: Subscriber: security_lake ASL-Main-Queue  -  OUTPUT: DEBUG: +++ Debug mode on - Level: 2
    DEBUG: The SQS queue is: https://queue.amazonaws.com/account-id/ASL-Main-Queue
    2023/04/05 09:19:57 wazuh-modulesd:aws-s3[3098] wm_aws.c:206 at wm_aws_main(): INFO: Fetching logs finished.
    2023/04/05 09:19:57 wazuh-modulesd:aws-s3[3098] wm_aws.c:80 at wm_aws_main(): DEBUG: Sleeping until: 2023/04/05 10:13:15

</details>

## Conclusion

The module works as expected, there are no repeated events due to the sequential execution of the module and the implemented logic which deletes the messages from the queue once sent to Analysisd.

**Comment by mateojames** [comment]
<h1> 🟢 Test Packet Encryption</h1>

The purpose of this test was to verify every connection involved in this process is properly encrypted. To do so, the ASL integration was manually executed by console:

>$ /var/ossec/wodles/aws/aws-s3 --subscriber security_lake --queue ASL-Main-Queue --iam_role_arn arn:aws:iam::account-id:role/ASL-Role --debug 2

At the same time, the packet listener `tcpdump` was executed with the following line:

>$ tcpdump -A -c 200

This resulted on the capture of packets sent and received in this process:
<details>

```
12:28:14.480832 IP wazuh-master.39706 > s3-1-w.amazonaws.com.https: Flags [.], ack 1460, win 501, length 0
E..(yJ@.@.......4.,........V`Q0TP.......
12:28:14.480873 IP s3-1-w.amazonaws.com.https > wazuh-master.39706: Flags [P.], seq 1460:2920, ack 1, win 65535, length 1460
E.....@.%.B_4.,.........`Q0T...VP....W....f...8.m.YJ.Ng4....bg.	.0.j.WM..4*...'..<..b......&...d.(.D.,.(....s.+.....Z.~..E<kB~..
.P......@....a.t.....h.s;.".
.~.|u.?..t~..Z.|..6..~A~...)....\w.x.d.......{.	..6(.[6....D..y..=......m...X>........iyQ.M......o.b%a..$6./=.N...n....m.6Ok~.$..H...w.+|...S..<...L7..a...:.aB)G.f{77......t....
...8.k2..e..W.BP:............D.T.o.Ub..........aQ..........Ul.W.>:...W'
 .$..9`k9.:D.I*...:.\...l7.-x..*...P.MV@...3m*
...y..."8....!..m.9...~Dr."..'.}...Z.[..Vb .q...F!=...C.=..iA..tN......l.&..wE.A[61..i."k/....P.e.....;0....
}s.]._..h....*q.@.so...<...ygN!....L|.w191,o..0.R....x....?.F...?...;....o..Q.9...(..Q....P.p..)/..]	(..
7.n.~l....,."{[fD$...mvo6....@..*r.s....o.A..........=....F.."m....E.S
..>em..U....p.h.z.~..#..o<..d..6Y.b.f...A.2[...M-e...(..Q..(.z..CA!...{....	....]..p6.y..]9.	..R.l..p......+Q...\'W.]..R.I...F ..,d..s..~i."Sp..:0.d..|[......l:/.%}.K..e'..PN.{.......	#.....c.
.!.xK..;........g.c...yi.....=)N....s..NS.d=E..L....j...I.9A..'0.."6..C..kQj1.q.
YYg...b._...*U	. .G.
Ud..;...p....QCC....	.......e...5c......7.
p...V~.R.h......"._.9...&..P.;.}..lw1.d*.}o....Di..I..yaH.P}..`C.T.M...a.!..WXI..v.F.6........ZgenD.{u......\c^...+.........2RRB...C...E.........5.{{....G..W..d0X?..C...N....:...U.P.!.Pw.....{.]m...|....y.Wv.....3.~/wqz...0..RHc8..S@..=Ab.N._.;.....\~{..P...H..R.4..0G.I.}d..;..gf.E:6"!..P.]....u.+...
............./....f5@...'.hq..._fVP...itk.....S......f=$..)wo.1.c.`\...u1!....S.....nf.N...P~.9\^...Zt~O..8.?.....4.d...
12:28:14.480885 IP wazuh-master.39706 > s3-1-w.amazonaws.com.https: Flags [.], ack 2920, win 496, length 0
E..(yK@.@.......4.,........V`Q6.P.......
12:28:14.483814 IP s3-1-w.amazonaws.com.https > wazuh-master.39706: Flags [P.], seq 2920:4380, ack 1, win 65535, length 1460
E.....@.%.B_4.,.........`Q6....VP...]...........r/Is...K.0......2G.e....V.n.+.9W.!...WT*5
....7.....O.%[.;.#r0.....et..T&K|.cU....@i..Y.:...b.P.C.(.|0._..Q..e.........o....&'s.O..v@j.;_}.+5.z@H...v...sJ7...W.......m...r.|Ct..A.3...,.....z#L.&.4.d..=...AE.....p..T].{.{...:Cdu...|P.U....K..$...........S,.70...<...).Y..Z...&.........&}....	..M....N....3..".v.0mCv.#5..Sk...-.....H....*....W.C........].T.....6=#P../d.Z\..*O.?.'Y.71()2`gH.I?s../...$../\.p.MrK.....6...0..K"v.L.. ..w$).v......V#kB.h.@....nbw{|.g8.:.=.....+.x.Jc..j..k=..i;...h..?....~.u1_>.
. .c. ....O...X......5.ae........&.......w.(@_.(j.B.....y.....]l..\I......".tg.Yh.Q...n....s...&9A)......w.$e...cKW!..qu..0.P.^u.3$}j...uP.......4.Z.".]....s.=.*..K&n8K....T'.-/Z......8y...X....]Y..
...) O.........g..._...*.R.........)...'p.U.....+V.......c..Ez0P.&.Y6."..V..............Y..G2..t..:...M...^.gX...<.5.g. K...F.X.)YV.,..|..;.....^.M7.Qd......?<..dq.t..,Z...4.w?
c....f....\Z...H.....K...q.../.?v..f..O..........U*`...,.m.d.J4..#.....6.~.xT.M.......:.N..P.0.8.......>.Q............fo..p..+..am._...r....D#M_@...D.U.......IM.....j..)..No....|.....i@.o..W....A..M.	.w..h.j.@w...W...H.x..........na..W...<....~..*..c..R7.|o......R..=@.8...A..........t..b9u...	......0#\v..]g..........@....*ev..IK..h.A..V.6V.7.9...I.0.^.....caXH<..@7N9.e.
...cs..l.&.....b=...W[c.}.)5...../...).t....p.z.p....J..%}R8k.)	BR...z0....K._..TQ.<........k..Kn...,.p.K..{.....A....M....6.....}O.......Og	.U!RU.^.g..{.G.\...`h.dD...`..#P.....r3.W......~.5....
12:28:14.483835 IP wazuh-master.39706 > s3-1-w.amazonaws.com.https: Flags [.], ack 4380, win 489, length 0
E..(yL@.@.......4.,........V`Q;.P.......
12:28:14.483841 IP s3-1-w.amazonaws.com.https > wazuh-master.39706: Flags [P.], seq 4380:5840, ack 1, win 65535, length 1460
E.....@.%.B_4.,.........`Q;....VP.......".RHe.%\....ud[i.(....r54.Q.<.G.8.j..Ra	{.[..
.O..Y..M...t..	..D........d{..;..c.F...Y.~......he:U...d.
.<}......Z....R....N.-...g........;*)..U.L...Jb....oE..?........k.V......]..[p..........P..g../X2Cr&']...	..y...]...J ..A.>..A....#.m.Z......B.....R.*.Bv6....F...<F..e_;!...~..l.U^.a?...v.EI.R.~r.~..f...YL]t.M.w`.^....2.y.....f......`fJy.c..=.&.98....fEG...q.7.v.)n...b..xKS.k...,@oFaX..W.t...S...m5.)../..O..L..B.gW.1....E....U>.-. ..c....r.d.r....+M..x>..'T~."7J..4..e....[..`............O..\..&.E....8...}..C..&...:..$..;O...%2.....q.5.Xk.....h.U.......e...T....ay....M...0..@9..qELy...?I.De.............r"V...K:............/..\.......l.KM.....Uy` ..w...4=....H.... w.....L...,(I~.=.........!....>F..C...!ty.K<2...#F..R[...S=.....hI....5?F...ch..+_..G.kqv./:]c....E...U...n.}...$e....h..*.u..U.l............p............b1P.M.i.]...{.!a..$.1...Bp.&...S....pCHQ:e......k..&`...$..l.-.F.............*.....
...J.....?z.C.....pj..C......E..5...NJ..%248..'[	ec6V.w.. ..cA.#.Dk...8.....]T........(..&..Y...9R...@.#E
.u...:u..r .'..Ij.j.w..>...0.......Lao...e.X....!..i.H....}I.F..F.s...q..B..u^..........U.i/>.....P.....,..:.A.P	qFR.lR.%-lkw".R25............Z..b.M..NA..jM.Ct..".o.;.[~......O..a...<..uE... .......T0...~...:.)...M....Y.|.g..~WV.j.....@.....z..p.F..}.........&.$Z#]4.A...XBf.NJL........[	..a.z...?A..eP.;e2..v..C<.
..|8.T(......b..4.F.#.U~_.G..&).....s'n.oG...C5....o.#\.ZEE....UnC....A..0d..J".zm.. +....&.....Us.$_..;.U...Od....]......42....
12:28:14.483847 IP wazuh-master.39706 > s3-1-w.amazonaws.com.https: Flags [.], ack 5840, win 481, length 0
E..(yM@.@.......4.,........V`QApP.......
12:28:14.483852 IP s3-1-w.amazonaws.com.https > wazuh-master.39706: Flags [P.], seq 5840:7300, ack 1, win 65535, length 1460
E.....@.%.B_4.,.........`QAp...VP..............6..$..~..8...5...p..Q{...cT.x...T.......6.d..b...82.J...w._A.s.].oi
...a&.a..eL4....,..`".6f.zwRm....r..-.l.;Qv..U7MpV....Obf............./..c....M....M...L.....k..(.f..M....v.%.O..INv.=......`.....F..?K.M.eq.8RV|wz..t.1mR=(.U..6Y..q..9..m....49.5<...X..~.MT,.Hl56.O....3.......&........c..zy.Tuo?}.*.../w.......[h.R6....is...n.....}......!4Buy._....o.X._...V..G..|#...K..............z# JGV.s....Oi.}f'yw..N....PX....Vj.e..U#p.7
......X..,2Z8b2..yZ....;n....S...TX.Y..G..a.*j.......V.pG.. ..L*......|...4...fx.r5....G.,`.:.....8._\...~.x..U.......(....H..3*...T.Of...v..b.....E...if.&XO....3=O.Gq5T.a...;k..9.c...~.d.......f..fQ.....C....'....a[p.u....v...Q.\.c.i.........r.K{.O..`.4......?..O3.O.4.M.F
k.....Mb././.y...".S.........6...Z.....[X..A..:q_...VQ..X.dP..6...*....e-..FY.&X5..o..J.0...W.+4.=.....@.r..\......,.-GNZ..F.....2%.."(!B.:E...9...D..	c.Dy.k.)*.Y~P.._..><l?.....A..Y........N....}0....X(.J......K.K..Fb/.nsE...Y.(...0....Vw.M.x.S@]{.h........).GSmt......y...c...A..>v.w......../8.........Vnk,k.....#:..5....E..A.Y.b. ~....]..b~...0x.g.&..Y......G.#D..&........l.q......Pg..E..Y..M.K...h]h..u...S..@t.. N^....n....V...i.@,... )g.......<D.37<n..6
.C. ..2.#r...JTl~*^...oo.}...d....l.M4g..D..&.Vf..vRX.gIZ.K..g.c....A../.#.X&D..8..l..fpE].H.G..%.C.;.....P	q.!...Z.A..&.R....w..S..c[1z..Q..jSc...[C@..qI.Q;...E	..kn.AB^.J...a.......c...i.......?.5.QI........e....K..C.......q^....r..z;%.r.MV..V.....7..?..Is .`t....3..$L..=.d......>.U&..\
12:28:14.483870 IP wazuh-master.39706 > s3-1-w.amazonaws.com.https: Flags [.], ack 7300, win 474, length 0
E..(yN@.@.......4.,........V`QG$P.......
12:28:14.483875 IP s3-1-w.amazonaws.com.https > wazuh-master.39706: Flags [P.], seq 7300:8760, ack 1, win 65535, length 1460
E.....@.%.B_4.,.........`QG$...VP...xt..
.=.
N"$rt.+K.9........7..V...CP.(..VN...(.':..EQ.....4}y5.I5W%..)....k...	.sO.wE..*O...;\4..2|.../.\.y7.Y.L....C.y..k.'.d...6......rh..{.M.......z.T..QF./Z;+..u.^t.*..0P>&J.V..._.I...A|.f3(.Y=j.SCO...Hx\.'.m.U.9/b....."uK......y......!.....\_.P.o.<D
.......V...
......3.R.*........*	..F.:c..........Wo..tj..Q.k.:f.........U..*..]~.5
n....I.s.4..I..3....W.r.M....K<.........6X.K....W.....
.8Q.U.....K:..C*^......!j.........v.q..+..2.........
..30..4IP..@..........!L...?...%.t.`...KQz...P5......:...2!..^.L{<..9...]..Bo.S.....
s;1....G......K{..Q............=.......).V...JJKzu...Y.N..R~O.=.y.|1..3.....!....M.$..4S..c.K..X.K..'..I..x..>.....t.....^.B..W8.5..oG.l@|..@.F.y
o.=D<2.A..O!<.<..Y>Yi...>.....k...g>$..;'.Z........@.#.$.M...RW;...J.....b...bg%O^#L...zf}^X..a........8.....(..q.qY..,X..k]l)..}.....x8.4..C................Y..G..vn9.f..C...K...:......(0..e.p..S..0`....0bE.[..ska$..@..K..+..q....4.[..FBs...q......k
H/.a.>.U3".>..A..H...0Qn.~n.mN.6..-T.+..3.~HQ..S)\.*.......#.......X..../.H...k....u/YP.+.p./..;g9........e.....K..XYN.....Ze).re)..
... `d........B....).-`Yj\..4.
 .."C..a.4+.w;...{.....PO....9...............%L....;.?..#K.0`.,o.6...w$...BY..z.]..S...._.,..V...8..ed.W&...L.......l..g...K{......_.+L..i8..$...C.0F>".V.z..>>@....nD..(.V...-AT....[...|...........M...fo+.)[....a...Sh.dt.?..=..,....o...7.k.	...b.}...(...8N.. u8n..E1Wk..y HdR......"........x......B3..3>)O.D............p........r...[b"&.N....Q......{.....Z.(U.Y\...........
12:28:14.483882 IP wazuh-master.39706 > s3-1-w.amazonaws.com.https: Flags [.], ack 8760, win 466, length 0
E..(yO@.@.......4.,........V`QL.P.......
12:28:14.488459 IP wazuh-master.59256 > 192.168.65.5.domain: 46323+ PTR? 204.44.217.52.in-addr.arpa. (44)
E..H.l@.@..r......A..x.5.4...............204.44.217.52.in-addr.arpa.....
12:28:14.489343 IP s3-1-w.amazonaws.com.https > wazuh-master.39706: Flags [P.], seq 8760:10220, ack 1, win 65535, length 1460
E.....@.%.B_4.,.........`QL....VP....]....a..].o=...*.t...
.kp..J
xkg]..g,R..G.........O.....I3...S....
....r`.?.Eb..r......|._.kw..."....Sq.B.....R...yD...(]...~..h..>...8..fZm|M:..g.^...~S......}.b.5g.IZ ....V...A.m..NwLAf.....<[.......+.%......,..GX+I....E/.a...	.^"...a.L....M...T.1..f..Ng...x..ng..C....g8[.G.^....9.7....L.........0u....K.O.....m.}..:@1...L.9:LG.\..Q.>-M(..aM.m..aQ:....g,..TV.~..a<.4.4Q.....%:..{..Dv..w.2%p...,....E.(.I.].:;...}..F.Z..<......V/...9>..y.........B#[.......Pw..........QSm. .pO.s=|...;..F..nN.....+....z;."w....6jZ.T....#?..?....M_J0........7.G.....z...\.^.....Fd....40..2].......~........:.....F.b..1...Yn..#. .;...R....<7.q..g.G...R.V..o#8...Py......-..oG......ap.%.#.M5...oL.G.J.?8.....Q\....`...B.....G .B......*......T.Ab.V.RV!a......%1........I...@.._..]...[.....0.[..{...%.T...<.....}.I.@..a.]...|S...p....t.@Ea..b;+D1.NX.~.q.@..y6I>Z4z.?_\.....ajE*...*...zX>.2*.<....+...;.!9......5Q'Wj..N.P.}.gQ.e...k.N.K.# =./3.1u..9x. ......pu.....^(.+......P......LQ.n"..&_i.}.\..W..}.,Z..3.....Mg..,......k.........S....E....UspMb.........{}................d.......Qcz.wLs2	...^....D.......4#........=....k.f....p..{>....#G.h.......R..G.....&....D.%......fsO....*R.}G........)..
.X.....3.,ZYJT.............., .b8.......".J...\K..+Y.'T.	..)J....z...v.y*	S.........'..R.)9.u...tZ{4......w&}...R.3V...B.p.8.A......i...............^...^.......-[..../(n	.~.p;.).m.....A.$.9 vB.a.:Q..3.y..0..p.rg.>ACZ/J..V..B..{.}...{.B0.~.).T.?...........\)+.>..a*.+..].hf.......%...1 .
12:28:14.489382 IP wazuh-master.39706 > s3-1-w.amazonaws.com.https: Flags [.], ack 10220, win 501, length 0
E..(yP@.@.......4.,........V`QR.P.......
12:28:14.489390 IP s3-1-w.amazonaws.com.https > wazuh-master.39706: Flags [P.], seq 10220:11680, ack 1, win 65535, length 1460
E.....@.%.B_4.,.........`QR....VP.......q..X.....s..W...j....	t.....&..QLef..xW..g....l?.#...F.PX..'..Uk...,..M...!.o....<.0..........=.F......!$.HP9...m&M..FVN.O..qD.UX...<.3......{.....eR...)......l.........-...,.&#...v`..E..m<B-. ...c..Kc..].....O.N..y. k.8(~p....T.f....|.-.aE._KF..U..:..Vn.T......._.zo..&.\!.X.......F...>|..L.	&K....6....6-.....4.`Pc...<...`4...).#X......	..?p..4...WX&VNF.l.Ba....U`i............`iu.....vT...KA..cI........q.@9?...g;F.I...>\.].......-E.D..=..O..M.=.y.].y..l....S.,...c6.....F....>.....]..#!..\.k..XX>Kd./L~.#?@.......w...,-..I.'.....s.l..xTo^..'..,&I]..
W..w...gu..|..;.o........o..,s:......:z....!a...>y.......>.....x........?........H...V.....w...<._^.9d...[EBU,...Il.6....kC.........
p..B....>....m..V'#H..>&...5!.(Mo7. .._.kL;...H...,.R?.>z.<66%My....Y..].].P.z...).w..hA.P......2..%.@.yr....=.W.8...73.....\.![.* ...V..o..........H+&|.}Tj.....7J.......\a...T.z..N.(.o\.wX....W.L:.Qj..z.......g"5.....9.5e..~..0;7....U8=X.(.....=&.'...?..0.$.wc.vZ..3..p.V...q...,..p.`..z....?gS..bK0.. F......V\_aBE`. .~..R1$F.T7p
.c.h.....F...6( .e.n....v......o.o..?4j..	.8.PV.EU.Jq[$>...tY..1o.
...Sfv..G......7...:3..T...t..u..z.3..4.S........x.0.j...gy......'A.........XR..V....E.).$...t3..I..g=.t...4s.V...O..W[.?...\..*k[...UO/$..#..M....Q...}.|8..)....[.:..^%`.7}..K.$.>...4nq..M.W........]aS..[a...U...@/.Z.?Z.........}V.......Z.......SnMK1.Q..K/.D.4n*......y.n.m...^....X........9.&=...A.........#.E..s.....VV.....|r=.)...P....P.....G".j..Zk."4....2.....i. .[...
12:28:14.489397 IP wazuh-master.39706 > s3-1-w.amazonaws.com.https: Flags [.], ack 11680, win 496, length 0
E..(yQ@.@.......4.,........V`QX@P.......
```

</details>

<h2>Conclusion</h2>

By analyzing the content of the packages captured we could confirm the connections involved are properly encrypted. The integration is securely handling sensitive data over the network.

**Comment by mateojames** [comment]
Following the issue https://github.com/wazuh/wazuh/issues/16678 the integration had to be tested again running with the versions of the dependencies `numpy==1.21.6` and `pyarrow==8.0.0`

<details><summary> 🟢 Numpy 1.21.6 installation</summary>

```
root@wazuh-master:/# /var/ossec/framework/python/bin/python3.9 -m pip install numpy==1.21.6
Collecting numpy==1.21.6
  Downloading numpy-1.21.6-cp39-cp39-manylinux_2_17_aarch64.manylinux2014_aarch64.whl (13.0 MB)
     ━━━━━━━━━━━━━━━━━━━━━━━━━━━━━━━━━━━━━━━━ 13.0/13.0 MB 3.2 MB/s eta 0:00:00
Installing collected packages: numpy
Successfully installed numpy-1.21.6
```

</details>

<details><summary> 🟢 PyArrow 8.0.0 installation</summary>

```
root@wazuh-master:/# /var/ossec/framework/python/bin/python3.9 -m pip install pyarrow==8.0.0
Collecting pyarrow==8.0.0
  Downloading pyarrow-8.0.0-cp39-cp39-manylinux_2_17_aarch64.manylinux2014_aarch64.whl (27.2 MB)
     ━━━━━━━━━━━━━━━━━━━━━━━━━━━━━━━━━━━━━━━━ 27.2/27.2 MB 3.3 MB/s eta 0:00:00
Requirement already satisfied: numpy>=1.16.6 in /var/ossec/framework/python/lib/python3.9/site-packages (from pyarrow==8.0.0) (1.21.6)
Installing collected packages: pyarrow
Successfully installed pyarrow-8.0.0
```

</details>

<details><summary> 🟢  Integration run</summary>

```
root@wazuh-master:~/.aws# /var/ossec/wodles/aws/aws-s3 --subscriber security_lake --queue AWS-REDACTED-Queue -p dev --debug 2
DEBUG: +++ Debug mode on - Level: 2
DEBUG: Generating default configuration for retries: mode standard - max_attempts 10
DEBUG: The SQS queue is: https://queue.amazonaws.com/REDACTED/AWS-REDACTED-Queue
DEBUG: Generating default configuration for retries: mode standard - max_attempts 10
DEBUG: Retrieving messages from: AWS-REDACTED-Queue
DEBUG: Processing file aws/REDACTED.gz.parquet in aws-REDACTED
DEBUG: Found 539 events in file aws/REDACTED.gz.parquet
DEBUG: 539 events sent to Analysisd
DEBUG: Message deleted from: AWS-REDACTED-Queue
DEBUG: Processing file aws/REDACTED.gz.parquet in aws-REDACTED
DEBUG: Found 24 events in file aws/REDACTED.gz.parquet
DEBUG: 24 events sent to Analysisd
DEBUG: Message deleted from: AWS-REDACTED-Queue
```

</details>

The integration was tested and it worked successfully.

**Comment by fdalmaup** [comment]
# Manual Testing

## Prerequisites

In order to carry out the manual testing and to consider it valid, the following conditions need to be addressed:
- `logall` option in the `ossec.conf` to verify the expected amount of events were sent to Analysisd.
- The expected output is present in the {wazuh_path}/logs/ossec.log file. The `wazuh_modules.debug=2` option will be set to have a more descriptive output.
- `<interval>` option of the `<wodle name="aws-s3">` block set to `1h` due to the number of messages saved in the SQS Queue, approximately 3400 messages which refer to parquet files with hundreds or thousands of events.
- Define the necessary credentials in the `/root/.aws/credentials` file to make use of the IAM Role Authenticating option.

### Basic configuration

<details><summary>ossec.conf</summary>

    <wodle name="aws-s3">
        <disabled>no</disabled>
        <interval>1h</interval>
        <run_on_start>yes</run_on_start>
        <subscriber type="security_lake">
             <sqs_name>sqs-security-lake-main-queue</sqs_name>
             <iam_role_arn>arn:aws:iam::example</iam_role_arn>
             <external_id>test_external_id</external_id>
             <iam_role_duration>1300</iam_role_duration>
        </subscriber>
    </wodle>

</details>

### Service Endpoint Option set



### STS Endpoint Option set

**Comment by fdalmaup** [comment]
# Regression Tests of Buckets and Services Tests

Due to the modifications applied to the `WazuhIntegration` class which is the parent class of every bucket and service class, we tested the correct function of the module for the `CloudTrail` and `Macie` buckets and the `CloudWatch Logs`  service.

<details><summary></summary>

    <wodle name="aws-s3">
        <disabled>no</disabled>
        <remove_from_bucket>no</remove_from_bucket>
        <interval>10m</interval>
        <run_on_start>yes</run_on_start>
        <skip_on_error>no</skip_on_error>
    
        <bucket type="cloudtrail">
            <aws_profile>dev</aws_profile>
            <name>wazuh-aws-wodle-cloudtrail</name>
            <only_logs_after>2022-MAR-21</only_logs_after>
        </bucket>
    
        <bucket type="custom">
            <aws_profile>dev</aws_profile>
            <name>wazuh-aws-wodle-macie</name>
            <only_logs_after>2022-JAN-01</only_logs_after>
        </bucket>
    
        <service type="cloudwatchlogs">
            <aws_profile>dev</aws_profile>
            <aws_log_groups>4_4_test</aws_log_groups>
            <only_logs_after>2022-DEC-01</only_logs_after>
            <regions>us-east-1</regions>
        </service>
    </wodle>

</details>

<details><summary>ossec.log</summary>

    2023/04/27 12:15:08 wazuh-modulesd:aws-s3[3229] wm_aws.c:62 at wm_aws_main(): INFO: Module AWS started
    2023/04/27 12:15:08 wazuh-modulesd:aws-s3[3229] wm_aws.c:84 at wm_aws_main(): INFO: Starting fetching of logs.
    2023/04/27 12:15:08 wazuh-modulesd:aws-s3[3229] wm_aws.c:136 at wm_aws_main(): INFO: Executing Bucket Analysis: (Bucket: wazuh-aws-wodle-cloudtrail, Type: cloudtrail, Profile: dev)
    2023/04/27 12:15:08 wazuh-modulesd:aws-s3[3229] wm_aws.c:376 at wm_aws_run_s3(): DEBUG: Create argument list
    2023/04/27 12:15:08 wazuh-modulesd:aws-s3[3229] wm_aws.c:491 at wm_aws_run_s3(): DEBUG: Launching S3 Command: wodles/aws/aws-s3 --bucket wazuh-aws-wodle-cloudtrail --aws_profile dev --only_logs_after 2022-MAR-21 --type cloudtrail --debug 2
    2023/04/27 12:15:13 wazuh-modulesd:aws-s3[3229] wm_aws.c:531 at wm_aws_run_s3(): DEBUG: Bucket:  -  OUTPUT: DEBUG: +++ Debug mode on - Level: 2
    DEBUG: Generating default configuration for retries: mode standard - max_attempts 10
    DEBUG: +++ Table does not exist; create
    DEBUG: +++ Working on 123456789123 - us-west-1
    DEBUG: +++ Marker: AWSLogs/123456789123/CloudTrail/us-west-1/2022/03/21
    DEBUG: ++ Found new log: AWSLogs/123456789123/CloudTrail/us-west-1/2022/03/30/123456789123_CloudTrail_us-west-1_20220330T0000Z_HASDoKlxgfdNInHa.json.gz
    DEBUG: ++ Found new log: AWSLogs/123456789123/CloudTrail/us-west-1/2022/03/30/123456789123_CloudTrail_us-west-1_20220330T0000Z_HASDoKlxgfdNInHa.json.zip
    DEBUG: ++ Found new log: AWSLogs/123456789123/CloudTrail/us-west-1/2022/03/30/123456789123_CloudTrail_us-west-1_20220330T0000Z_HASDoKlxgfdkdIOa.json.txt
    DEBUG: ++ Found new log: AWSLogs/123456789123/CloudTrail/us-west-1/2022/03/30/123456789123_CloudTrail_us-west-1_20220330T0002Z_HASDoKlxgfdNInHa.json.zip
    DEBUG: ++ Found new log: AWSLogs/123456789123/CloudTrail/us-west-1/2023/04/06/123456789123_CloudTrail_us-west-1_20230406T0002Z_HASDoKlxgfdNInHa.json
    DEBUG: ++ Found new log: AWSLogs/123456789123/CloudTrail/us-west-1/2023/04/06/123456789123_CloudTrail_us-west-1_20230406T0002Z_HASDoKlxgfdNInHb.json
    DEBUG: ++ Found new log: AWSLogs/123456789123/CloudTrail/us-west-1/2023/04/11/123456789123_CloudTrail_us-west-1_20230411T1755Z_2CqtXDyI0zFiYm1J.json
    DEBUG: ++ Found new log: AWSLogs/123456789123/CloudTrail/us-west-1/2023/04/14/123456789123_CloudTrail_us-west-1_20230411T1755Z_2CqtXDyI0zFiYm1J.json
    DEBUG: +++ DB Maintenance
    DEBUG: +++ Working on 123123456789 - us-west-1
    DEBUG: +++ Marker: AWSLogs/123123456789/CloudTrail/us-west-1/2022/03/21
    DEBUG: +++ No logs to process in bucket: 123123456789/us-west-1
    DEBUG: +++ DB Maintenance
    DEBUG: +++ Working on 789123123456 - us-west-1
    DEBUG: +++ Marker: AWSLogs/789123123456/CloudTrail/us-west-1/2022/03/21
    DEBUG: ++ Found new log: AWSLogs/789123123456/CloudTrail/us-west-1/2023/01/25/123456789123_CloudTrail_us-west-1_20211223T0000Z_HASDOtJxxxxxxxxx.json.gz
    DEBUG: +++ DB Maintenance
    
    2023/04/27 12:15:13 wazuh-modulesd:aws-s3[3229] wm_aws.c:136 at wm_aws_main(): INFO: Executing Bucket Analysis: (Bucket: wazuh-aws-wodle-macie, Type: custom, Profile: dev)
    2023/04/27 12:15:13 wazuh-modulesd:aws-s3[3229] wm_aws.c:376 at wm_aws_run_s3(): DEBUG: Create argument list
    2023/04/27 12:15:13 wazuh-modulesd:aws-s3[3229] wm_aws.c:491 at wm_aws_run_s3(): DEBUG: Launching S3 Command: wodles/aws/aws-s3 --bucket wazuh-aws-wodle-macie --aws_profile dev --only_logs_after 2022-JAN-01 --type custom --debug 2
    2023/04/27 12:15:18 wazuh-modulesd:aws-s3[3229] wm_aws.c:531 at wm_aws_run_s3(): DEBUG: Bucket:  -  OUTPUT: DEBUG: +++ Debug mode on - Level: 2
    DEBUG: Generating default configuration for retries: mode standard - max_attempts 10
    DEBUG: +++ Table does not exist; create
    DEBUG: +++ Marker: 2022/01/01
    DEBUG: ++ Found new log: 2022/02/14/firehose_macie-1-2022-02-14-01-20-42-eb1f80bc-5d9d-426b-a0a1-e0ad8d3ef656
    DEBUG: ++ Found new log: 2022/11/09/firehose_macie-1-2021-12-01-00-40-40-e269348f-0b8e-4f61-a4e9-995424ftest1
    DEBUG: ++ Found new log: 2022/11/09/firehose_macie-1-2021-12-01-00-40-40-e269348f-0b8e-4f61-a4e9-995424ftest1nolat
    DEBUG: ++ Found new log: 2022/11/09/firehose_macie-1-2021-12-01-00-40-40-e269348f-0b8e-4f61-a4e9-995424ftest2
    DEBUG: ++ Found new log: 2022/11/09/firehose_macie-1-2022-02-14-01-20-42-eb1f80bc-5d9d-426b-a0a1-e0ad8d3ef656
    DEBUG: ++ Found new log: 2022/11/10/firehose_macie-1-2021-12-01-00-40-40-with-geolocation-1
    DEBUG: ++ Found new log: 2022/11/10/firehose_macie-1-2021-12-01-00-40-40-with-geolocation-2
    DEBUG: ++ Found new log: 2022/11/10/firehose_macie-1-2022-02-14-01-20-42-no-geolocation
    DEBUG: +++ DB Maintenance
    --
    2023/04/27 12:15:20 wazuh-modulesd:aws-s3[3229] wm_aws.c:171 at wm_aws_main(): INFO: Executing Service Analysis: (Service: cloudwatchlogs, Profile: dev)
    2023/04/27 12:15:20 wazuh-modulesd:aws-s3[3229] wm_aws.c:555 at wm_aws_run_service(): DEBUG: Create argument list
    2023/04/27 12:15:20 wazuh-modulesd:aws-s3[3229] wm_aws.c:659 at wm_aws_run_service(): DEBUG: Launching S3 Command: wodles/aws/aws-s3 --service cloudwatchlogs --aws_profile dev --only_logs_after 2022-DEC-01 --regions us-east-1 --aws_log_groups 4_4_test --debug 2
    2023/04/27 12:15:23 wazuh-modulesd:aws-s3[3229] wm_aws.c:700 at wm_aws_run_service(): DEBUG: Service: cloudwatchlogs  -  OUTPUT: DEBUG: +++ Debug mode on - Level: 2
    DEBUG: +++ Getting alerts from "us-east-1" region.
    DEBUG: Generating default configuration for retries: mode standard - max_attempts 10
    DEBUG: only logs: 1669852800000
    DEBUG: +++ Table does not exist; create
    DEBUG: Getting log streams for "4_4_test" log group
    DEBUG: Found "test_stream" log stream in 4_4_test
    DEBUG: Getting data from DB for log stream "test_stream" in log group "4_4_test"
    DEBUG: Token: "None", start_time: "None", end_time: "None"
    DEBUG: Getting CloudWatch logs from log stream "test_stream" in log group "4_4_test" using token "None", start_time "1669852800000" and end_time "None"
    DEBUG: +++ Sending events to Analysisd...
    DEBUG: The message is "test log 05-12-22 #1"
    DEBUG: +++ Sending events to Analysisd...
    DEBUG: The message is "test log 12-12-22 #1"
    DEBUG: +++ Sending events to Analysisd...
    DEBUG: The message is "test log 12-12-22 #2"
    DEBUG: Getting CloudWatch logs from log stream "test_stream" in log group "4_4_test" using token "f/37261757152099465362158772923796054646091708432059990016/s", start_time "1669852800000" and end_time "None"
    DEBUG: Saving data for log group "4_4_test" and log stream "test_stream".
    DEBUG: The saved values are "{'token': 'f/37261757152132916477936604954625336921053419536048422911/s', 'start_time': 1669852800000, 'end_time': 1670874978409}"
    DEBUG: Purging the BD
    DEBUG: Getting log streams for "4_4_test" log group
    DEBUG: Found "test_stream" log stream in 4_4_test
    DEBUG: committing changes and closing the DB
    
    2023/04/27 12:15:24 wazuh-modulesd:aws-s3[3229] wm_aws.c:201 at wm_aws_main(): INFO: Fetching logs finished.
    2023/04/27 12:15:24 wazuh-modulesd:aws-s3[3229] wm_aws.c:80 at wm_aws_main(): DEBUG: Sleeping until: 2023/04/27 13:15:08

</details>

## Conclusion

The module worked as expected.
