### ISSUE TITLE
Agentless not working

### ISSUE THREAD

**Issue by kouled** [wazuh/wazuh#27482]
|Wazuh version|Component|Install type|Install method|Platform|
|---|---|---|---|---|
|v4.9.2 | Wazuh component | Manager/Agentless | Packages/Sources | Ubunutu 22.04 |

Hi
I install (very good documentation to install from A to Z for the 3 main comp: Indexer, Manager and Dashboard)

Then I try to put the agentless <=> issue start here:
1st) The device / endpoint that I try to target is a FreeBSD (my pfsense) --> I'm not using the ssh default port 22 --> How to configure a specific port in the agent less (May be this is the issue et the erro message is just wrong)

2nd) I follow the page :
https://documentation.wazuh.com/current/user-manual/capabilities/agentless-monitoring/connection.html

So I add the host
I list I can see it in the list... 
I can also connect from where the wazuh server to the psfense in ssh (specifying the correct port) :
ssh -p '2222' -i '/var/ossec/.ssh/id_rsa' 'login@mypfsense.localnet.net'.

I check that the agentlessd is running:
/var/ossec/bin/wazuh-control status | grep agentless

I get as outpu:
wazuh-agentlessd is running...

But when I check the logs I get this output:
cat /var/ossec/logs/ossec.log | grep wazuh-agentlessd

Output:
wazuh-agentlessd: ERROR: ssh_integrity_check_bsd: login@mypfsense.localnet.net: Password for 'login@mypfsense.localnet.net' not found.

N.B.: to add the host I run the command:
/var/ossec/agentless/register_host.sh add login@mypfsense.localnet.net:2222 NOPASS
--> I use certificate for connection and I add the port 

Many thanks in advnace for your advice

**Comment by kouled** [comment]
Addendum

Runn the following command
sudo tcpdump -i any port 514 -n

I can see the firewall and another device sending syslog to Wazuh Manager:
00:41:41.222621 ens18 In  IP 192.168.1.1.514 > 192.168.1.40.514: SYSLOG local0.info, length: 178
00:41:42.608862 ens18 In  IP 192.168.1.110.514 > 192.168.1.40.514: UDP, length 458
00:41:43.378278 ens18 In  IP 192.168.1.1.514 > 192.168.1.40.514: SYSLOG daemon.notice, length: 235
00:41:43.378278 ens18 In  IP 192.168.1.1.514 > 192.168.1.40.514: SYSLOG daemon.notice, length: 258
00:41:45.222598 ens18 In  IP 192.168.1.1.514 > 192.168.1.40.514: SYSLOG local0.info, length: 181


192.168.1.40 --> Wazuh Manager
192.168.1.110 --> Synology NAS
192.168.1.1 --> My pfsense

And the other log / error that I get also link to this subject:
Jan 2, 2025 @ 01:29:22.000 wazuh-remoted WARNING  (1213): Message from '192.168.1.1' not allowed. Cannot find the ID of the agent. Source agent ID is unknown.
Jan 2, 2025 @ 01:29:22.000 wazuh-remoted WARNING  (1213): Message from '192.168.1.110' not allowed. Cannot find the ID of the agent. Source agent ID is unknown.

Those endpoints send they log to the Wazuh server <=> NO Agent is set...
 
In the /var/ossec/etc/ossec.conf file I of course set all those remote:

<remote>
  <connection>syslog</connection>
  <port>514</port>
  <protocol>udp</protocol>
  <allowed-ips>192.168.1.1/24</allowed-ips>
  <allowed-ips>192.168.1.110/24</allowed-ips>
  <local_ip>192.168.1.40</local_ip>
</remote>

I don't know what I can do more.

Thank you
