### ISSUE TITLE
Documentation and Evidence Gathering for Cluster by default

### ISSUE THREAD

**Issue by fdalmaup** [wazuh/wazuh#32406]
## Description

This issue focuses on gathering and documenting all development and testing efforts related to the Cluster by default objective. The goal is to provide traceability for:

- Functional and non-functional requirements.
- Implementation constraints and architectural decisions.
- Testing strategies and results.
- Supporting evidence (logs, reports, coverage, etc.).

### Requirements Summary
 
- Summarize functional requirements addressed during the Cluster by default objective.
- Summarize non-functional requirements.
- Document implementation constraints or assumptions.

### Development Overview

-  Outline key modules or components refactored.
-  Explain major design/architecture decisions taken.
-  Reference related PRs, commits, or discussions contributing to the refactor.

### Testing Overview

- List and describe test cases validating the refactored functionality.
- Mention test environments and platforms used for coverage (Linux, Windows, macOS, etc.).

**Comment by fdalmaup** [comment]
# Requirements Summary

## Functional Requirements

### 1. The cluster must always initialize on startup on all installations (single node behaves as a one-node cluster).

<details><summary>Single-node start up</summary>
<p>

```xml
<cluster>
    <name>wazuh</name>
    <node_name>node01</node_name>
    <node_type>master</node_type>
    <key>9d273b53510fef702b54a92e9cffc82e</key>
    <port>1516</port>
    <bind_addr>localhost</bind_addr>
    <nodes>
        <node>172.17.0.3</node>
    </nodes>
    <hidden>no</hidden>
</cluster>
```

```console
[root@cd7d4d2af78e ossec]# /var/ossec/bin/wazuh-control start
2025/10/08 15:45:16 wazuh-modulesd:router: INFO: Loaded router module.
2025/10/08 15:45:16 wazuh-modulesd:content_manager: INFO: Loaded content_manager module.
2025/10/08 15:45:16 wazuh-modulesd:inventory-sync: INFO: Loaded Inventory sync module.
Starting Wazuh v5.0.0...
Started wazuh-apid...
Started wazuh-authd...
Started wazuh-db...
Started wazuh-execd...
Started wazuh-analysisd...
Started wazuh-syscheckd...
Started wazuh-remoted...
Started wazuh-logcollector...
Started wazuh-monitord...
2025/10/08 15:45:18 wazuh-modulesd:router: INFO: Loaded router module.
2025/10/08 15:45:18 wazuh-modulesd:content_manager: INFO: Loaded content_manager module.
2025/10/08 15:45:18 wazuh-modulesd:inventory-sync: INFO: Loaded Inventory sync module.
Started wazuh-modulesd...
Started wazuh-clusterd...
Completed.
[root@cd7d4d2af78e ossec]# ps -auxf
USER         PID %CPU %MEM    VSZ   RSS TTY      STAT START   TIME COMMAND
root           1  0.0  0.0  13456  3496 pts/0    SNs  15:36   0:00 bash
wazuh       2643 14.4  0.4 869992 100744 ?       SNl  15:45   0:02 /var/ossec/framework/python/bin/python3 /var/ossec/api/scripts/wazuh_apid.py
wazuh       2644  0.0  0.2 164892 61284 ?        SN   15:45   0:00  \_ /var/ossec/framework/python/bin/python3 /var/ossec/api/scripts/wazuh_apid.py
wazuh       2645  0.0  0.2 164892 60692 ?        SN   15:45   0:00  \_ /var/ossec/framework/python/bin/python3 /var/ossec/api/scripts/wazuh_apid.py
wazuh       2648  0.0  0.2 312356 61308 ?        SN   15:45   0:00  \_ /var/ossec/framework/python/bin/python3 /var/ossec/api/scripts/wazuh_apid.py
wazuh       2651  0.0  0.2 459820 61040 ?        SN   15:45   0:00  \_ /var/ossec/framework/python/bin/python3 /var/ossec/api/scripts/wazuh_apid.py
root        2667  0.0  0.0 120012  9064 ?        SNl  15:45   0:00 /var/ossec/bin/wazuh-authd
wazuh       2676  0.0  0.0 787532  9656 ?        SNl  15:45   0:00 /var/ossec/bin/wazuh-db
root        2699  0.0  0.0  37452  3156 ?        SNl  15:45   0:00 /var/ossec/bin/wazuh-execd
root        2707  1.3  0.5 3478336 124340 ?      SNl  15:45   0:00 /var/ossec/bin/wazuh-analysisd
root        2823 12.7  0.0 142264 13144 ?        SNl  15:45   0:01 /var/ossec/bin/wazuh-syscheckd
wazuh       2833  0.0  0.0 780912 11800 ?        SNl  15:45   0:00 /var/ossec/bin/wazuh-remoted
root        2863  0.0  0.0 445616  9068 ?        SNl  15:45   0:00 /var/ossec/bin/wazuh-logcollector
wazuh       2876  0.0  0.0  37592  3616 ?        SNl  15:45   0:00 /var/ossec/bin/wazuh-monitord
root        2882  5.7  0.1 510352 43360 ?        SNl  15:45   0:00 /var/ossec/bin/wazuh-modulesd
wazuh       3047  1.6  0.2 384324 67260 ?        SNl  15:45   0:00 /var/ossec/framework/python/bin/python3 /var/ossec/framework/scripts/wazuh_clusterd.py
wazuh       3068  0.0  0.2 163128 60428 ?        SN   15:45   0:00  \_ /var/ossec/framework/python/bin/python3 /var/ossec/framework/scripts/wazuh_clusterd.py
wazuh       3069  0.0  0.2 163128 60412 ?        SN   15:45   0:00  \_ /var/ossec/framework/python/bin/python3 /var/ossec/framework/scripts/wazuh_clusterd.py
root        3861  0.0  0.0  51404  3880 pts/0    RN+  15:45   0:00 ps -auxf
[root@cd7d4d2af78e ossec]# cat logs/cluster.log
2025/10/08 15:45:19 INFO: [Local Server] [Main] Serving on /var/ossec/queue/cluster/c-internal.sock
2025/10/08 15:45:19 INFO: [Master] [Main] Serving on ('127.0.0.1', 1516)
2025/10/08 15:45:19 INFO: [Master] [Local agent-groups] Sleeping 30s before starting the agent-groups task, waiting for the workers connection.
[root@cd7d4d2af78e ossec]# tcpdump -i any tcp port 1516
tcpdump: verbose output suppressed, use -v or -vv for full protocol decode
listening on any, link-type LINUX_SLL (Linux cooked), capture size 262144 bytes
```

</p>
</details>

<details><summary>One-node start up</summary>
<p>

* Manager

```xml
<cluster>
    <name>wazuh</name>
    <node_name>node01</node_name>
    <node_type>master</node_type>
    <key>9d273b53510fef702b54a92e9cffc82e</key>
    <port>1516</port>
    <bind_addr>172.17.0.5</bind_addr>
    <nodes>
        <node>172.17.0.5</node>
    </nodes>
    <hidden>no</hidden>
</cluster>
```

```console
[root@71908eae3812 ossec]# bin/wazuh-control start
2025/10/09 08:47:06 wazuh-modulesd:router: INFO: Loaded router module.
2025/10/09 08:47:06 wazuh-modulesd:content_manager: INFO: Loaded content_manager module.
2025/10/09 08:47:06 wazuh-modulesd:inventory-sync: INFO: Loaded Inventory sync module.
Starting Wazuh v5.0.0...
Started wazuh-apid...
Started wazuh-authd...
Started wazuh-db...
Started wazuh-execd...
Started wazuh-analysisd...
Started wazuh-syscheckd...
Started wazuh-remoted...
Started wazuh-logcollector...
Started wazuh-monitord...
2025/10/09 08:47:10 wazuh-modulesd:router: INFO: Loaded router module.
2025/10/09 08:47:10 wazuh-modulesd:content_manager: INFO: Loaded content_manager module.
2025/10/09 08:47:10 wazuh-modulesd:inventory-sync: INFO: Loaded Inventory sync module.
Started wazuh-modulesd...
Started wazuh-clusterd...
Completed.
[root@71908eae3812 ossec]# ps auxf
USER         PID %CPU %MEM    VSZ   RSS TTY      STAT START   TIME COMMAND
root           1  0.0  0.0  13456  3464 pts/0    SNs  08:14   0:00 bash
wazuh       4082 18.3  0.4 869984 100808 ?       SNl  08:47   0:02 /var/ossec/framework/python/bin/python3 /var/ossec/api/scripts/wazuh_apid.py
wazuh       4083  0.0  0.2 164884 61336 ?        SN   08:47   0:00  \_ /var/ossec/framework/python/bin/python3 /var/ossec/api/scripts/wazuh_apid.py
wazuh       4084  0.0  0.2 164884 60616 ?        SN   08:47   0:00  \_ /var/ossec/framework/python/bin/python3 /var/ossec/api/scripts/wazuh_apid.py
wazuh       4087  0.0  0.2 246812 61396 ?        SN   08:47   0:00  \_ /var/ossec/framework/python/bin/python3 /var/ossec/api/scripts/wazuh_apid.py
wazuh       4090  0.0  0.2 459812 61468 ?        SN   08:47   0:00  \_ /var/ossec/framework/python/bin/python3 /var/ossec/api/scripts/wazuh_apid.py
root        4106  0.0  0.0 120012  9056 ?        SNl  08:47   0:00 /var/ossec/bin/wazuh-authd
wazuh       4115  0.1  0.0 787528  9744 ?        SNl  08:47   0:00 /var/ossec/bin/wazuh-db
root        4138  0.0  0.0  37456  3296 ?        SNl  08:47   0:00 /var/ossec/bin/wazuh-execd
root        4146  1.7  0.5 3478344 123704 ?      SNl  08:47   0:00 /var/ossec/bin/wazuh-analysisd
root        4264 14.5  0.0 142276 12700 ?        SNl  08:47   0:01 /var/ossec/bin/wazuh-syscheckd
wazuh       4273  0.0  0.0 780916 12308 ?        SNl  08:47   0:00 /var/ossec/bin/wazuh-remoted
root        4304  0.0  0.0 445612  9260 ?        SNl  08:47   0:00 /var/ossec/bin/wazuh-logcollector
wazuh       4317  0.0  0.0  29396  3348 ?        SN   08:47   0:00 /var/ossec/bin/wazuh-monitord
root        4323  9.2  0.1 504204 43496 ?        SNl  08:47   0:00 /var/ossec/bin/wazuh-modulesd
wazuh       4487  2.7  0.2 310600 66944 ?        SNl  08:47   0:00 /var/ossec/framework/python/bin/python3 /var/ossec/framework/scripts/wazuh_clusterd.py
wazuh       4507  0.0  0.2 163136 60400 ?        SN   08:47   0:00  \_ /var/ossec/framework/python/bin/python3 /var/ossec/framework/scripts/wazuh_clusterd.py
wazuh       4508  0.0  0.2 163136 60404 ?        SN   08:47   0:00  \_ /var/ossec/framework/python/bin/python3 /var/ossec/framework/scripts/wazuh_clusterd.py
root        5144  0.0  0.0  51404  3784 pts/0    RN+  08:47   0:00 ps auxf
[root@cd7d4d2af78e ossec]# cat logs/cluster.log
2025/10/09 08:47:10 INFO: [Local Server] [Main] Serving on /var/ossec/queue/cluster/c-internal.sock
2025/10/09 08:47:10 INFO: [Master] [Main] Serving on ('172.17.0.5', 1516)
2025/10/09 08:47:10 INFO: [Master] [Local agent-groups] Sleeping 30s before starting the agent-groups task, waiting for the workers connection.
2025/10/09 08:48:16 INFO: [Worker] [Main] Connection from ('172.17.0.4', 45952)
2025/10/09 08:48:16 INFO: [Worker node02] [Main] Starting cluster tasks.
2025/10/09 08:48:16 INFO: [Master] [Local integrity] Starting.
2025/10/09 08:48:16 INFO: [Master] [Local agent-groups] Starting.
2025/10/09 08:48:16 INFO: [Master] [Local agent-groups] Finished in 0.001s.
2025/10/09 08:48:16 INFO: [Worker node02] [Agent-groups send] Starting.
2025/10/09 08:48:16 INFO: [Master] [Local integrity] Finished in 0.003s. Calculated metadata of 4 files.
2025/10/09 08:48:16 INFO: [Worker node02] [Agent-groups send] Finished in 0.005s. Updated 1 chunks.
2025/10/09 08:48:24 INFO: [Master] [Local integrity] Starting.
2025/10/09 08:48:24 INFO: [Master] [Local integrity] Finished in 0.003s. Calculated metadata of 4 files.
2025/10/09 08:48:25 INFO: [Worker node02] [Integrity check] Starting.
2025/10/09 08:48:25 INFO: [Worker node02] [Integrity check] Finished in 0.005s. Received metadata of 4 files. Sync not required.
[root@71908eae3812 ossec]# tcpdump -i any tcp port 1516
tcpdump: verbose output suppressed, use -v or -vv for full protocol decode
listening on any, link-type LINUX_SLL (Linux cooked), capture size 262144 bytes
08:49:36.505716 IP 71908eae3812.vpad > 172.17.0.4.45952: Flags [P.], seq 623556856:623556976, ack 1422840850, win 64, options [nop,nop,TS val 1720366392 ecr 1117783345], length 120
08:49:36.506216 IP 172.17.0.4.45952 > 71908eae3812.vpad: Flags [P.], seq 1:121, ack 120, win 63, options [nop,nop,TS val 1117791239 ecr 1720366392], length 120
08:49:36.506234 IP 71908eae3812.vpad > 172.17.0.4.45952: Flags [.], ack 121, win 64, options [nop,nop,TS val 1720366393 ecr 1117791239], length 0
```

* Worker

```xml
<cluster>
    <name>wazuh</name>
    <node_name>node01</node_name>
    <node_type>master</node_type>
    <key>9d273b53510fef702b54a92e9cffc82e</key>
    <port>1516</port>
    <bind_addr>localhost</bind_addr>
    <nodes>
        <node>172.17.0.5</node>
    </nodes>
    <hidden>no</hidden>
</cluster>
```

```console
[root@1c91d78a338c ossec]# bin/wazuh-control start
2025/10/09 08:48:10 wazuh-modulesd:router: INFO: Loaded router module.
2025/10/09 08:48:10 wazuh-modulesd:content_manager: INFO: Loaded content_manager module.
2025/10/09 08:48:10 wazuh-modulesd:inventory-sync: INFO: Loaded Inventory sync module.
Starting Wazuh v5.0.0...
Started wazuh-authd...
Started wazuh-db...
Started wazuh-execd...
Started wazuh-analysisd...
Started wazuh-syscheckd...
Started wazuh-remoted...
Started wazuh-logcollector...
Started wazuh-monitord...
2025/10/09 08:48:15 wazuh-modulesd:router: INFO: Loaded router module.
2025/10/09 08:48:15 wazuh-modulesd:content_manager: INFO: Loaded content_manager module.
2025/10/09 08:48:15 wazuh-modulesd:inventory-sync: INFO: Loaded Inventory sync module.
Started wazuh-modulesd...
Started wazuh-clusterd...
Completed.
[root@1c91d78a338c ossec]# ps auxf
USER         PID %CPU %MEM    VSZ   RSS TTY      STAT START   TIME COMMAND
root           1  0.0  0.0  13456  3440 pts/0    SNs  08:14   0:00 bash
root        5375  0.0  0.0 111816  9316 ?        SNl  08:48   0:00 /var/ossec/bin/wazuh-authd
wazuh       5383  0.1  0.0 787532  9724 ?        SNl  08:48   0:00 /var/ossec/bin/wazuh-db
root        5406  0.0  0.0  37456  3132 ?        SNl  08:48   0:00 /var/ossec/bin/wazuh-execd
root        5414  1.5  0.5 3478336 123924 ?      SNl  08:48   0:00 /var/ossec/bin/wazuh-analysisd
root        5536 18.5  0.0 142276 13096 ?        SNl  08:48   0:01 /var/ossec/bin/wazuh-syscheckd
wazuh       5545  0.0  0.0 780912 12268 ?        SNl  08:48   0:00 /var/ossec/bin/wazuh-remoted
root        5576  0.0  0.0 445616  9536 ?        SNl  08:48   0:00 /var/ossec/bin/wazuh-logcollector
wazuh       5589  0.0  0.0  29392  3532 ?        SN   08:48   0:00 /var/ossec/bin/wazuh-monitord
root        5595 12.0  0.1 493964 42344 ?        SNl  08:48   0:00 /var/ossec/bin/wazuh-modulesd
wazuh       5760  4.4  0.3 311056 70556 ?        SNl  08:48   0:00 /var/ossec/framework/python/bin/python3 /var/ossec/framework/scripts/wazuh_clusterd.py
wazuh       5776  0.0  0.2 163112 60144 ?        SN   08:48   0:00  \_ /var/ossec/framework/python/bin/python3 /var/ossec/framework/scripts/wazuh_clusterd.py
root        6338  0.0  0.0  51404  3920 pts/0    RN+  08:48   0:00 ps auxf
[root@cd7d4d2af78e ossec]# cat logs/cluster.log
2025/10/09 08:48:16 INFO: [Local Server] [Main] Serving on /var/ossec/queue/cluster/c-internal.sock
2025/10/09 08:48:16 INFO: [Worker node02] [Main] Successfully connected to master.
2025/10/09 08:48:16 INFO: [Worker node02] [Agent-groups recv] Starting.
2025/10/09 08:48:16 INFO: [Worker node02] [Agent-groups recv] Finished in 0.005s. Updated 1 chunks.
2025/10/09 08:48:25 INFO: [Worker node02] [Integrity check] Starting.
2025/10/09 08:48:25 INFO: [Worker node02] [Integrity check] Finished in 0.012s. Sync not required.
2025/10/09 08:48:26 INFO: [Worker node02] [Agent-info sync] Starting.
2025/10/09 08:48:26 INFO: [Worker node02] [Agent-info sync] No synchronization required, skipping.
2025/10/09 08:48:26 INFO: [Worker node02] [Agent-groups recv] Starting.
2025/10/09 08:48:26 INFO: [Worker node02] [Agent-groups recv] Finished in 0.002s. Updated 1 chunks.
2025/10/09 08:48:34 INFO: [Worker node02] [Integrity check] Starting.
2025/10/09 08:48:34 INFO: [Worker node02] [Integrity check] Finished in 0.010s. Sync not required.
2025/10/09 08:48:36 INFO: [Worker node02] [Agent-info sync] Starting.
2025/10/09 08:48:36 INFO: [Worker node02] [Agent-groups recv] Starting.
2025/10/09 08:48:36 INFO: [Worker node02] [Agent-info sync] No synchronization required, skipping.
2025/10/09 08:48:36 INFO: [Worker node02] [Agent-groups recv] Finished in 0.002s. Updated 1 chunks.
2025/10/09 08:48:43 INFO: [Worker node02] [Integrity check] Starting.
2025/10/09 08:48:43 INFO: [Worker node02] [Integrity check] Finished in 0.009s. Sync not required.
2025/10/09 08:48:46 INFO: [Worker node02] [Agent-info sync] Starting.
2025/10/09 08:48:46 INFO: [Worker node02] [Agent-groups recv] Starting.
2025/10/09 08:48:46 INFO: [Worker node02] [Agent-info sync] No synchronization required, skipping.
2025/10/09 08:48:46 INFO: [Worker node02] [Agent-groups recv] Finished in 0.003s. Updated 1 chunks.
```

</p>
</details>

### 2. There is no configuration option to disable the cluster — the cluster.disabled option must be removed and ignored if present in legacy configs (with a deprecation warning).

<details><summary>Start-up with disabled</summary>
<p>

```console
[root@711a43fe469d ossec]# bin/wazuh-control start
2025/10/09 09:04:02 wazuh-db: WARNING: Detected a deprecated configuration for cluster. The 'disabled' option is not longer available.
2025/10/09 09:04:02 wazuh-modulesd:router: INFO: Loaded router module.
2025/10/09 09:04:02 wazuh-modulesd:content_manager: INFO: Loaded content_manager module.
2025/10/09 09:04:02 wazuh-modulesd:inventory-sync: INFO: Loaded Inventory sync module.
Starting Wazuh v5.0.0...
wazuh-apid already running...
wazuh-authd already running...
wazuh-db already running...
wazuh-execd already running...
wazuh-analysisd already running...
wazuh-syscheckd already running...
wazuh-remoted already running...
wazuh-logcollector already running...
wazuh-monitord already running...
wazuh-modulesd already running...
wazuh-clusterd already running...
Completed.
[root@711a43fe469d ossec]# ps auxf
USER         PID %CPU %MEM    VSZ   RSS TTY      STAT START   TIME COMMAND
root           1  0.0  0.0  13456  3284 pts/0    SNs  08:07   0:00 bash
wazuh       1169  0.2  0.4 871608 104168 ?       SNl  08:14   0:07 /var/ossec/framework/python/bin/python3 /var/ossec/api/scripts/wazuh_apid.py
wazuh       1279  0.0  0.2 168092 64608 ?        SN   08:14   0:00  \_ /var/ossec/framework/python/bin/python3 /var/ossec/api/scripts/wazuh_apid.py
wazuh       1280  0.0  0.2 168092 63828 ?        SN   08:14   0:00  \_ /var/ossec/framework/python/bin/python3 /var/ossec/api/scripts/wazuh_apid.py
wazuh       1283  0.0  0.2 315556 64660 ?        SN   08:14   0:00  \_ /var/ossec/framework/python/bin/python3 /var/ossec/api/scripts/wazuh_apid.py
wazuh       1286  0.0  0.2 463020 64708 ?        SN   08:14   0:00  \_ /var/ossec/framework/python/bin/python3 /var/ossec/api/scripts/wazuh_apid.py
root        1183  0.0  0.0 120020  9256 ?        SNl  08:14   0:00 /var/ossec/bin/wazuh-authd
wazuh       1192  0.0  0.0 787532 10372 ?        SNl  08:14   0:02 /var/ossec/bin/wazuh-db
root        1215  0.0  0.0  37456  3240 ?        SNl  08:14   0:00 /var/ossec/bin/wazuh-execd
root        1223  1.0  0.5 3478344 125972 ?      SNl  08:14   0:31 /var/ossec/bin/wazuh-analysisd
root        1362  0.1  0.0 208048 13108 ?        SNl  08:14   0:03 /var/ossec/bin/wazuh-syscheckd
wazuh       1370  0.0  0.0 780908 11968 ?        SNl  08:14   0:00 /var/ossec/bin/wazuh-remoted
root        1401  0.0  0.0 511124  9468 ?        SNl  08:14   0:00 /var/ossec/bin/wazuh-logcollector
wazuh       1415  0.0  0.0  37588  4368 ?        SNl  08:14   0:00 /var/ossec/bin/wazuh-monitord
root        1421  0.0  0.1 551320 44412 ?        SNl  08:14   0:01 /var/ossec/bin/wazuh-modulesd
wazuh       1488  0.0  0.2 384328 67180 ?        SNl  08:14   0:00 /var/ossec/framework/python/bin/python3 /var/ossec/framework/scripts/wazuh_clusterd.py
wazuh       1493  0.0  0.2 163132 60476 ?        SN   08:14   0:00  \_ /var/ossec/framework/python/bin/python3 /var/ossec/framework/scripts/wazuh_clusterd.py
wazuh       1494  0.0  0.2 163132 60480 ?        SN   08:14   0:00  \_ /var/ossec/framework/python/bin/python3 /var/ossec/framework/scripts/wazuh_clusterd.py
root        2582  0.0  0.0  51404  3792 pts/0    RN+  09:04   0:00 ps auxf
```

</p>
</details>

### 3. The default cluster bind_addr must be localhost (overridable by explicit configuration).

<details><summary>Fresh installed manager</summary>
<p>

```console
[root@137b3e664c36 wazuh]# yum localinstall wazuh-manager_5.0.0-0_x86_64_cfe2e38.rpm
Loaded plugins: fastestmirror, ovl
Examining wazuh-manager_5.0.0-0_x86_64_cfe2e38.rpm: wazuh-manager-5.0.0-0.x86_64
Marking wazuh-manager_5.0.0-0_x86_64_cfe2e38.rpm to be installed
Resolving Dependencies
--> Running transaction check
---> Package wazuh-manager.x86_64 0:5.0.0-0 will be installed
--> Finished Dependency Resolution

Dependencies Resolved

=====================================================================================================================================================================================================================
 Package                                         Arch                                     Version                                      Repository                                                               Size
=====================================================================================================================================================================================================================
Installing:
 wazuh-manager                                   x86_64                                   5.0.0-0                                      /wazuh-manager_5.0.0-0_x86_64_cfe2e38                                   885 M

Transaction Summary
=====================================================================================================================================================================================================================
Install  1 Package

Total size: 885 M
Installed size: 885 M
Is this ok [y/d/N]: y
Downloading packages:
Running transaction check
Running transaction test
Transaction test succeeded
Running transaction
  Installing : wazuh-manager-5.0.0-0.x86_64                                                                                                                                                                      1/1
  Verifying  : wazuh-manager-5.0.0-0.x86_64                                                                                                                                                                      1/1

Installed:
  wazuh-manager.x86_64 0:5.0.0-0

Complete!
[root@137b3e664c36 wazuh]# cat /var/ossec/etc/ossec.conf | grep '<bind_addr>'
    <bind_addr>localhost</bind_addr>
```

</p>
</details>

### 4. Remove all references to a "cluster disabled" status in logs, API, and dashboard. Keep cluster name displays where appropriate.



### 5. Single-node deployments must behave identically to a functional one-node cluster (master) with no extra user configuration.

As we can see before the only difference between a single-node and a one-node cluster is that the single don't execute the periodic tasks related to nodes syncronization.


### 6. Cluster configuration block review:

   ```xml
   <cluster>
      <name>wazuh</name>
      <node_name>node01</node_name>
      <node_type>master</node_type>
      <key></key>
      <port>1516</port>
      <bind_addr>localhost</bind_addr>
      <nodes>
         <node>NODE_IP</node>
      </nodes>
      <hidden>no</hidden>
   </cluster>
   ```


   - Remove unused or obsolete options.
      - Cluster `disabled` was removed
   - Retain only necessary fields.
   - Define and apply explicit default values.
      - We failed to set a default for `key` and `node` with the default configuration the manager throws an error

      ```console
      [root@4a6efefe115b ossec]# bin/wazuh-control start
      2025/10/09 10:18:59 wazuh-modulesd:router: INFO: Loaded router module.
      2025/10/09 10:18:59 wazuh-modulesd:content_manager: INFO: Loaded content_manager module.
      2025/10/09 10:18:59 wazuh-modulesd:inventory-sync: INFO: Loaded Inventory sync module.
      wazuh-clusterd: Configuration error. Exiting
      ```

   - Define which fields are shown by default in the generated or packaged ossec.conf.

### 7. Every module must be reviewed to ensure that any references to cluster and non-cluster scenarios or configurations are removed.

As we can see before both scenarios are working after the changes.

* https://github.com/wazuh/wazuh/issues/31693#issuecomment-3357262751
* https://github.com/wazuh/wazuh/issues/31693#issuecomment-3357636074

### 8. The Wazuh Dashboard must be reviewed to remove any references, logic, or configuration based on cluster/non-cluster distinctions.

* https://github.com/wazuh/wazuh-dashboard-plugins/pull/7701#pullrequestreview-3256968302


## Non-Functional Requirements

### 1. Security by default: No external exposure of cluster ports unless the admin overrides bind_addr.
### 2. Startup performance: No material increase in startup time vs 4.x.
### 3. Resource usage parity: A 5.0 default manager (cluster-by-default, single node) must not consume more resources than a 4.x default manager without a cluster, allowing normal measurement variance (±5%). This includes:
   - Average and peak CPU during idle and steady-state.
   - Resident memory (RSS).
   - Open file descriptors and process/thread count.
   - Disk I/O at idle.
   - Network traffic at idle (should be ~0 on a single node).

https://github.com/wazuh/wazuh/issues/31590#issuecomment-3385678672

### 4. Observability: Clear logs for always-on cluster init and for ignored legacy options.
### 5. Test coverage: Unit, component, integration, functionality, and performance regression tests for single- and multi-node scenarios.


## Implementation Restrictions

### 1. Do not introduce a new "disable cluster" escape hatch; always-on is mandatory.
### 2. Do not remove cluster.name or UI/API elements that legitimately reference the cluster name.
### 3. Changes must be compatible with all supported OS/distributions.
### 4. Updated defaults and removed fields in the <cluster> block must be reflected consistently across:
   - Config parsing code.
   - Config templates in packages.
   - Documentation.

## Development Overview


## Testing Overview


## Technical debt
